"Населено място","Търговски обект","Наименование на продукта","Код на продукта","Категория","Цена на дребно","Цена в промоция"
"68134","Ф23 - УЛ. СВ.НИКОЛА НОВИ №8","БИСКВИТИ ОБИКНОВЕНИ ПТИ БЬОР ПЪЛНОЗ. 225 ГР ПАПАДО","161309","66","1.22",""
"68134","Ф23 - УЛ. СВ.НИКОЛА НОВИ №8","КРОАСАН MILKA ВАНИЛИЯ 50 ГР","161384","67","1.12",""
"68134","Ф23 - УЛ. СВ.НИКОЛА НОВИ №8","КРОАСАН MILKA ШОКОЛАД 50 ГР","161389","67","1.12",""
"68134","Ф23 - УЛ. СВ.НИКОЛА НОВИ №8","ШОКОЛАД MILKA МЛЕЧЕН 90 ГР","161456","69","1.99",""
"68134","Ф23 - УЛ. СВ.НИКОЛА НОВИ №8","ШОКОЛАД МЛЕЧЕН LINDT LINDOR 100 Г","161498","69","2.99",""
"68134","Ф23 - УЛ. СВ.НИКОЛА НОВИ №8","КРОАСАН 7 DAYS МАКС ГОРСКИ ПЛОДОВЕ 80 ГР","161602","67","0.86","0.61"
"68134","Ф23 - УЛ. СВ.НИКОЛА НОВИ №8","КРОАСАН 7 DAYS МАКС ДАБЪЛ КОКОС И КАКАО 80 ГР","161603","67","0.86","0.61"
"68134","Ф23 - УЛ. СВ.НИКОЛА НОВИ №8","КРОАСАН 7 DAYS МАКС ФЪСТЪЦИ И КАКАО 80 ГР","161604","67","0.86","0.61"
"68134","Ф23 - УЛ. СВ.НИКОЛА НОВИ №8","БИСКВИТИ ЖИТЕН ДАР PETIT BEURRE ВАНИЛИЯ 220 ГР","161628","66","1.38",""
"68134","Ф23 - УЛ. СВ.НИКОЛА НОВИ №8","БИСКВИТИ ОБИКНОВЕНИ ЗАКУСКА С КАКАО 290 ГР ПОБЕДА","162008","66","1.78","1.59"
"68134","Ф23 - УЛ. СВ.НИКОЛА НОВИ №8","ДОМАТИ БИО HARMONICA ПАСИРАНИ 680 ГР","163530","48","3.06",""
"68134","Ф23 - УЛ. СВ.НИКОЛА НОВИ №8","ДОМАТИ БИО HARMONICA ПАСИРАНИ С БОСИЛЕК 680 ГР БУТИЛКА","163692","48","3.06",""
"68134","Ф23 - УЛ. СВ.НИКОЛА НОВИ №8","ШОКОЛАД ROSHEN АЕРО МЛЕЧЕН 80 ГР КАСИ","164274","69","1.49",""
"68134","Ф23 - УЛ. СВ.НИКОЛА НОВИ №8","КРОАСАН IQ КРЕМ ЛЕШНИК И КАКАО 110 ГР","164661","67","0.92",""
"68134","Ф23 - УЛ. СВ.НИКОЛА НОВИ №8","ШОКОЛАД МЛЕЧЕН 80 ГР  КАСИ","165019","69","1.27",""
"68134","Ф23 - УЛ. СВ.НИКОЛА НОВИ №8","ШОКОЛАД LACMI МЛЕЧЕН 90 ГР","165289","69","1.69","0.79"
"68134","Ф23 - УЛ. СВ.НИКОЛА НОВИ №8","КРОАСАН BELINO КРЕМ КАКАО 80 ГР","165711","67","0.61","0.51"
"68134","Ф23 - УЛ. СВ.НИКОЛА НОВИ №8","КРОАСАН BELINO ЧЕРЕША 80 ГР","165712","67","0.61","0.51"
"68134","Ф23 - УЛ. СВ.НИКОЛА НОВИ №8","КРОАСАН LOTTO ВКУС ИТАЛИАНСКО ПЕНЛИВО ВИНО 110 ГР","166131","67","0.71",""
"68134","Ф23 - УЛ. СВ.НИКОЛА НОВИ №8","КРОАСАН LOTTO КРЕМ КАКАО И ВАНИЛИЯ 110 ГР","166132","67","0.71",""
"68134","Ф23 - УЛ. СВ.НИКОЛА НОВИ №8","КРОАСАН LOTTO КРЕМ КАКАО И ЛЕШНИК 110 ГР","166133","67","0.71",""
"68134","Ф23 - УЛ. СВ.НИКОЛА НОВИ №8","БИСКВИТИ ЖИТЕН ДАР ОБИКНОВЕНИ С КАКАО 210 ГР","166150","66","1.38",""
"68134","Ф23 - УЛ. СВ.НИКОЛА НОВИ №8","КРОАСАН 7 DAYS МАКС КРЕМ БРЮЛЕ 92 ГР","166170","67","0.86","0.61"
"68134","Ф23 - УЛ. СВ.НИКОЛА НОВИ №8","КРОАСАН 7 DAYS МАКС КРЕМ ВАНИЛИЯ И БИСКВИТИ 92 ГР","166171","67","0.86","0.61"
"68134","Ф23 - УЛ. СВ.НИКОЛА НОВИ №8","КРОАСАН 7 DAYS МАКС ДАБЪЛ ВАНИЛИЯ И ВИШНА 92 ГР","166172","67","0.86","0.61"
"68134","Ф23 - УЛ. СВ.НИКОЛА НОВИ №8","КРОАСАН 7 DAYS МАКС ДАБЪЛ ВАНИЛИЯ И ЯГОДА 92 ГР","166173","67","0.86","0.61"
"68134","Ф23 - УЛ. СВ.НИКОЛА НОВИ №8","КРОАСАН 7 DAYS МАКС КРЕМ КАКАО 92 ГР","166174","67","0.86","0.61"
"68134","Ф23 - УЛ. СВ.НИКОЛА НОВИ №8","КРОАСАН 7 DAYS МАКС ДАБЪЛ КАКАО И ВАНИЛИЯ 92 ГР","166175","67","0.86","0.61"
"68134","Ф23 - УЛ. СВ.НИКОЛА НОВИ №8","КРОАСАН 7 DAYS МАКС КРЕМ ЛЕШНИК 92 ГР","166177","67","0.86","0.61"
"68134","Ф23 - УЛ. СВ.НИКОЛА НОВИ №8","ШОКОЛАД LZ МЛЕЧЕН 36 ГР КАСИ","166228","69","1.02",""
"68134","Ф23 - УЛ. СВ.НИКОЛА НОВИ №8","ШОКОЛАД СВОГЕ ФИН МЛЕЧЕН 80 ГР","166262","69","1.43",""
"68134","Ф23 - УЛ. СВ.НИКОЛА НОВИ №8","БИСКВИТИ ОБИКНОВЕНИ НАЯ КЛАСИК 180 ГР","166481","66","1.22","1.05"
"68134","Ф23 - УЛ. СВ.НИКОЛА НОВИ №8","КРОАСАН 7 DAYS СУПЕР МАКС ВАНИЛИЯ И ВИШНА 110 ГР","166966","67","1.02",""
"68134","Ф23 - УЛ. СВ.НИКОЛА НОВИ №8","КРОАСАН 7 DAYS СУПЕР МАКС КАКАО 110 ГР","166967","67","1.02",""
"68134","Ф23 - УЛ. СВ.НИКОЛА НОВИ №8","КРОАСАН 7 DAYS СУПЕР МАКС КАКАО И ВАНИЛИЯ 110 ГР","166968","67","1.02",""
"68134","Ф23 - УЛ. СВ.НИКОЛА НОВИ №8","ШАМПОАН SCHAUMA ВЪЗСТАНОВЯВАНЕ 400 МЛ SCHWARZKOPF/HENKEL","168005","82","2.91",""
"68134","Ф23 - УЛ. СВ.НИКОЛА НОВИ №8","ШАМПОАН ELSEVE ARGININE RESIST 400 МЛ","168062","82","7.39",""
"68134","Ф23 - УЛ. СВ.НИКОЛА НОВИ №8","ШАМПОАН SCHAUMA ИНТЕНЗИВЕН ПРОТИВ ПЪРХОТ МЪЖКИ 400 МЛ","168252","82","2.91",""
"68134","Ф23 - УЛ. СВ.НИКОЛА НОВИ №8","ШАМПОАН ELSEVE TOTAL REPAIR 5 250 МЛ LOREAL","168253","82","5.57",""
"68134","Ф23 - УЛ. СВ.НИКОЛА НОВИ №8","ШАМПОАН ELSEVE FULL RESIST 250 МЛ","168301","82","5.57",""
"68134","Ф23 - УЛ. СВ.НИКОЛА НОВИ №8","ШАМПОАН ELSEVE EXTRAORDINARY OIL 250 МЛ","168590","82","5.57",""
"68134","Ф23 - УЛ. СВ.НИКОЛА НОВИ №8","ШАМПОАН ЗДРАВЕ АКТИВ СТИМУЛИРАЩ 390/400 МЛ","168714","82","5.11",""
"68134","Ф23 - УЛ. СВ.НИКОЛА НОВИ №8","ШАМПОАН ЗДРАВЕ АКТИВ ДЪЛБОКО ПОЧИСТВАЩ 390/400 МЛ","168715","82","5.11",""
"68134","Ф23 - УЛ. СВ.НИКОЛА НОВИ №8","ШАМПОАН ЗДРАВЕ АКТИВ ЕНЕРГИЗИРАЩ 390/400 МЛ","168716","82","5.11",""
"68134","Ф23 - УЛ. СВ.НИКОЛА НОВИ №8","ШАМПОАН FRUCTIS SOS REPAIR 250 МЛ LOREAL","168955","82","4.44","2.69"
"68134","Ф23 - УЛ. СВ.НИКОЛА НОВИ №8","ШАМПОАН FRUCTIS GROW STRONG 400МЛ LOREAL","168959","82","5.62","4.25"
"68134","Ф23 - УЛ. СВ.НИКОЛА НОВИ №8","ШАМПОАН FRUCTIS SOS REPAIR 400 МЛ LOREAL","168967","82","5.62","4.25"
"68134","Ф23 - УЛ. СВ.НИКОЛА НОВИ №8","ШАМПОАН ЗДРАВЕ ДЕТОКСИКИРАЩ 390/400 МЛ","169042","82","5.11",""
"68134","Ф23 - УЛ. СВ.НИКОЛА НОВИ №8","ШАМПОАН GLISS SUPREME LENGHT 250 МЛ","169046","82","4.58",""
"68134","Ф23 - УЛ. СВ.НИКОЛА НОВИ №8","ШАМПОАН BOTANIC THERAPY МЕД И ПРОПОЛИС 250 МЛ","169090","82","4.32",""
"68134","Ф23 - УЛ. СВ.НИКОЛА НОВИ №8","ШАМПОАН BOTANIC THERAPY МЕД И ПРОПОЛИС 400 МЛ","169091","82","5.36",""
"68134","Ф23 - УЛ. СВ.НИКОЛА НОВИ №8","ШАМПОАН BOTANIC THERAPY РИЦИН МАСЛО И БАДЕМ 400 МЛ","169095","82","5.36",""
"68134","Ф23 - УЛ. СВ.НИКОЛА НОВИ №8","КОМПЛЕКТ САПУН DOVE ORIGINAL 4 БР X 90 Г","169153","83","3.98",""
"68134","Ф23 - УЛ. СВ.НИКОЛА НОВИ №8","ШАМПОАН ELSEVE DREAM LONG 250 МЛ","169287","82","5.57",""
"68134","Ф23 - УЛ. СВ.НИКОЛА НОВИ №8","ШАМПОАН ELSEVE DREAM LONG 400 МЛ","169288","82","7.39",""
"68134","Ф23 - УЛ. СВ.НИКОЛА НОВИ №8","ШАМПОАН SYOSS MEN CLEAN & COOL 440 МЛ МЪЖКИ","169471","82","4.34",""
"68134","Ф23 - УЛ. СВ.НИКОЛА НОВИ №8","ШАМПОАН SYOSS KERATIN 440 МЛ","169474","82","4.34",""
"68134","Ф23 - УЛ. СВ.НИКОЛА НОВИ №8","ШАМПОАН SYOSS MEN POWER 440 МЛ МЪЖКИ","169475","82","4.34",""
"68134","Ф23 - УЛ. СВ.НИКОЛА НОВИ №8","ШАМПОАН SYOSS VOLUME 440 МЛ","169480","82","4.34",""
"68134","Ф23 - УЛ. СВ.НИКОЛА НОВИ №8","САПУН DOVE PINK 90 Г","169519","83","1.19",""
"68134","Ф23 - УЛ. СВ.НИКОЛА НОВИ №8","САПУН ТЕО MILK DELICATE CARE 90 Г","169561","83","1.02",""
"68134","Ф23 - УЛ. СВ.НИКОЛА НОВИ №8","САПУН ТЕО MILK HONEY 90 Г","169562","83","1.02",""
"68134","Ф23 - УЛ. СВ.НИКОЛА НОВИ №8","САПУН ТЕО MILK SENSUAL CARE 90 Г","169565","83","1.02",""
"68134","Ф23 - УЛ. СВ.НИКОЛА НОВИ №8","САПУН ТЕО MILK  COCONUT 90 Г","169566","83","1.02",""
"68134","Ф23 - УЛ. СВ.НИКОЛА НОВИ №8","САПУН ЧИСТО ВЪГЛЕН 90 Г","169568","83","1.02","0.75"
"68134","Ф23 - УЛ. СВ.НИКОЛА НОВИ №8","САПУН KRISPA ШЕА И АРГАН 100 Г","169581","83","1.10",""
"68134","Ф23 - УЛ. СВ.НИКОЛА НОВИ №8","САПУН ТЕО MILK ULTRA HYGIENE 90 Г АНТИБАКТ. СЪСТАВКА","169598","83","1.02",""
"68134","Ф23 - УЛ. СВ.НИКОЛА НОВИ №8","САПУН TESORI D ORIENTE БЯЛ МУСКУС 125 Г","169606","83","2.74",""
"68134","Ф23 - УЛ. СВ.НИКОЛА НОВИ №8","САПУН TESORI D ORIENTE КИТАЙСКА ОРХИДЕЯ 125 Г","169607","83","2.74",""
"68134","Ф23 - УЛ. СВ.НИКОЛА НОВИ №8","САПУН PALMOLIVE HYGIENE PLUS АЛОЕ 90 Г","169637","83","1.22",""
"68134","Ф23 - УЛ. СВ.НИКОЛА НОВИ №8","К-Т САПУН SAFEGUARD КЛАСИК 4БР Х 90Г","169653","83","4.19",""
"68134","Ф23 - УЛ. СВ.НИКОЛА НОВИ №8","САПУН KRISPA ГЛИЦЕРИНОВ 100 Г","169698","83","1.82",""
"68134","Ф23 - УЛ. СВ.НИКОЛА НОВИ №8","САПУН ENGLISH SOAP MEN САНД. ДЪРВО И АМБЪР 190 Г","169699","83","6.64","5.09"
"68134","Ф23 - УЛ. СВ.НИКОЛА НОВИ №8","ШАМПОАН ELSEVE HYALURON 250 МЛ","169765","82","5.57",""
"68134","Ф23 - УЛ. СВ.НИКОЛА НОВИ №8","ШАМПОАН ELSEVE HYALURON 400 МЛ","169766","82","7.39",""
"68134","Ф23 - УЛ. СВ.НИКОЛА НОВИ №8","ШАМПОАН ALPECIN C1 КОФЕИНОВ 250 МЛ","169860","82","6.64","6.19"
"68134","Ф23 - УЛ. СВ.НИКОЛА НОВИ №8","ШАМПОАН HEAD & SHOULDERS КЛАСИК 500 МЛ","169885","82","6.33",""
"68134","Ф23 - УЛ. СВ.НИКОЛА НОВИ №8","ШАМПОАН HEAD & SHOULDERS ЦИТРУС 500 МЛ","169886","82","6.33",""
"68134","Ф23 - УЛ. СВ.НИКОЛА НОВИ №8","ШАМПОАН FRUCTIS ALOE 400 МЛ","169975","82","5.62","4.25"
"68134","Ф23 - УЛ. СВ.НИКОЛА НОВИ №8","ШАМПОАН PANTENE AQUA LIGHT 400 МЛ","169998","82","7.15",""
"68134","Ф23 - УЛ. СВ.НИКОЛА НОВИ №8","ПРЕПАРАТ ЗА СЪДОВЕ ЕХО БАЛСАМ ЛАЙКА 400 МЛ","170925","79","1.49","1.15"
"68134","Ф23 - УЛ. СВ.НИКОЛА НОВИ №8","САПУН DOVE DRAGON FRUIT 90 Г","172130","83","1.19",""
"68134","Ф23 - УЛ. СВ.НИКОЛА НОВИ №8","ШАМПОАН BOTANIC THERAPY OAT DELICACY 400 МЛ","172213","82","5.36",""
"68134","Ф23 - УЛ. СВ.НИКОЛА НОВИ №8","ШАМПОАН FRUCTIS GROW STRONG VITAMIN 400 МЛ","172214","82","5.62","4.25"
"68134","Ф23 - УЛ. СВ.НИКОЛА НОВИ №8","ШАМПОАН ALPECIN C1 BLACK EDITION 250 МЛ","172222","82","7.66","6.69"
"68134","Ф23 - УЛ. СВ.НИКОЛА НОВИ №8","ШАМПОАН WASH & GO БИЛКИ 360 МЛ","172245","82","3.98",""
"68134","Ф23 - УЛ. СВ.НИКОЛА НОВИ №8","ШАМПОАН WASH & GO КОПРИВА 360 МЛ","172246","82","3.98",""
"68134","Ф23 - УЛ. СВ.НИКОЛА НОВИ №8","ШАМПОАН WASH & GO МЕНТОЛ 360 МЛ","172249","82","3.98",""
"68134","Ф23 - УЛ. СВ.НИКОЛА НОВИ №8","ШАМПОАН WASH & GO ПРОТИВ ПЪРХОТ 360 МЛ","172250","82","3.98",""
"68134","Ф23 - УЛ. СВ.НИКОЛА НОВИ №8","ШАМПОАН BOTANIC THERAPY MAGNETIC CHARCOAL 250 МЛ","172259","82","4.32",""
"68134","Ф23 - УЛ. СВ.НИКОЛА НОВИ №8","ШАМПОАН BOTANIC THERAPY MAGNETIC CHARCOAL 400 МЛ","172260","82","5.36",""
"68134","Ф23 - УЛ. СВ.НИКОЛА НОВИ №8","ШАМПОАН WASH & GO ЛАВАНДУЛА 360 МЛ","172266","82","3.98",""
"68134","Ф23 - УЛ. СВ.НИКОЛА НОВИ №8","ШАМПОАН YVES ROCHER ЗА ОБЕМ 300 МЛ","172306","82","6.95",""
"68134","Ф23 - УЛ. СВ.НИКОЛА НОВИ №8","ШАМПОАН YVES ROCHER ПРОТИВ КОСОПАД 300 МЛ","172308","82","6.95",""
"68134","Ф23 - УЛ. СВ.НИКОЛА НОВИ №8","ШАМПОАН YVES ROCHER ПРОТИВ ПЪРХОТ 300 МЛ","172309","82","6.95",""
"68134","Ф23 - УЛ. СВ.НИКОЛА НОВИ №8","ШАМПОАН HEAD & SHOULDERS МЕНТОЛ 250 МЛ","172756","82","3.98",""
"68134","Ф23 - УЛ. СВ.НИКОЛА НОВИ №8","ШАМПОАН HEAD & SHOULDERS MENTHOL FRESH 2В1 330 МЛ","172764","82","5.11",""
"68134","Ф23 - УЛ. СВ.НИКОЛА НОВИ №8","* ШАМПОАН HEAD & SHOULDERS MENTHOL FRESH 330 МЛ","172765","82","5.11",""
"68134","Ф23 - УЛ. СВ.НИКОЛА НОВИ №8","ШАМПОАН ЗА КОСА ELSEVE HYALURON PURE 250 МЛ","172767","82","5.57",""
"68134","Ф23 - УЛ. СВ.НИКОЛА НОВИ №8","ШАМПОАН ЗА КОСА ELSEVE HYALURON PURE 400 МЛ","172768","82","7.39",""
"68134","Ф23 - УЛ. СВ.НИКОЛА НОВИ №8","ШАМПОАН HEAD & SHOULDERS CITRUS FRESH 330 МЛ","172773","82","5.11",""
"68134","Ф23 - УЛ. СВ.НИКОЛА НОВИ №8","ШАМПОАН HEAD & SHOULDERS CLASSIC 330 МЛ","172775","82","5.11",""
"68134","Ф23 - УЛ. СВ.НИКОЛА НОВИ №8","ШАМПОАН HEAD & SHOULDERS OCEAN 330 МЛ","172777","82","5.11",""
"68134","Ф23 - УЛ. СВ.НИКОЛА НОВИ №8","ШАМПОАН HEAD & SHOULDERS 2В1 ЦЯЛОСТНА ГРИЖА 330 МЛ","172782","82","5.11",""
"68134","Ф23 - УЛ. СВ.НИКОЛА НОВИ №8","ШАМПОАН HEAD & SHOULDERS ДЪЛБОКА ХИДРАТАЦИЯ 500 МЛ","172784","82","6.33",""
"68134","Ф23 - УЛ. СВ.НИКОЛА НОВИ №8","ШАМПОАН HEAD & SHOULDERS КОФЕИН ЗА МЪЖЕ 330 МЛ","172786","82","5.11",""
"68134","Ф23 - УЛ. СВ.НИКОЛА НОВИ №8","ШАМПОАН HEAD & SHOULDERS МЕНТОЛ 500 МЛ","172787","82","6.33",""
"68134","Ф23 - УЛ. СВ.НИКОЛА НОВИ №8","ПАСТА ЗА ЗЪБИ COLGATE MAX WHITE PURPLE REVEAL 75 МЛ","172821","81","2.76",""
"68134","Ф23 - УЛ. СВ.НИКОЛА НОВИ №8","ПАСТА ЗА ЗЪБИ COLGATE ADVANCED WHITE CHARCOAL 125 МЛ","172826","81","4.09",""
"68134","Ф23 - УЛ. СВ.НИКОЛА НОВИ №8","ПАСТА ЗА ЗЪБИ PARODONTAX ACTIVE REPAIR FRESH MINT 75 МЛ","172836","81","4.80",""
"68134","Ф23 - УЛ. СВ.НИКОЛА НОВИ №8","ПАСТА ЗА ЗЪБИ COLGATE MAX WHITE EXP ULTRA MULTIPURPOSE 50 МЛ","172851","81","5.60",""
"68134","Ф23 - УЛ. СВ.НИКОЛА НОВИ №8","ПАСТА ЗА ЗЪБИ COLGATE MAX FRESH GREEN TEA 75 МЛ","172870","81","3.06",""
"68134","Ф23 - УЛ. СВ.НИКОЛА НОВИ №8","ПАСТА ЗА ЗЪБИ LACALUT ACTIV PLUS 75 МЛ","172874","81","5.87","3.79"
"68134","Ф23 - УЛ. СВ.НИКОЛА НОВИ №8","ПАСТА ЗА ЗЪБИ ORAL-B 3DW LUXE 75 МЛ","172875","81","3.88",""
"68134","Ф23 - УЛ. СВ.НИКОЛА НОВИ №8","ПАСТА ЗА ЗЪБИ ORAL-B 3DW PRO VITALIZING FRESH 75 МЛ","172877","81","3.56",""
"68134","Ф23 - УЛ. СВ.НИКОЛА НОВИ №8","ПАСТА ЗА ЗЪБИ ORAL-B COMPLETE PROTECT & CLEAN 75 МЛ","172878","81","2.75",""
"68134","Ф23 - УЛ. СВ.НИКОЛА НОВИ №8","ПАСТА ЗА ЗЪБИ ORAL-B COMPLETE ULTIMATE FRESH 75 МЛ","172879","81","2.75",""
"68134","Ф23 - УЛ. СВ.НИКОЛА НОВИ №8","ПАСТА ЗА ЗЪБИ ORAL-B PRO EXPERT CLEAN MINT 75 МЛ","172880","81","3.56",""
"68134","Ф23 - УЛ. СВ.НИКОЛА НОВИ №8","ПАСТА ЗА ЗЪБИ ORAL-B PRO EXPERT SENSITIVE 75 МЛ","172881","81","3.56",""
"68134","Ф23 - УЛ. СВ.НИКОЛА НОВИ №8","ПАСТА ЗА ЗЪБИ SENSODYNE CLINICAL REPAIR 75 МЛ","172892","81","5.57",""
"68134","Ф23 - УЛ. СВ.НИКОЛА НОВИ №8","ПАСТА ЗА ЗЪБИ ORAL-B PRO REPAIR ORIGINAL 75 МЛ","172896","81","6.06",""
"68134","Ф23 - УЛ. СВ.НИКОЛА НОВИ №8","ШАМПОАН PANTENE REPAIR PROTECT 400 МЛ","172920","82","7.15",""
"68134","Ф23 - УЛ. СВ.НИКОЛА НОВИ №8","КЪРПИ ВЛАЖНИ HANKIES EXTRA SAFE АНТИБАКТ. 4Х12 БР","173921","84","1.89","1.55"
"68134","Ф23 - УЛ. СВ.НИКОЛА НОВИ №8","ПАСТА ЗА ЗЪБИ ELMEX SENSITIVE PLUS COMPLETE PTOTECTION 75 МЛ","176009","81","5.36",""
"68134","Ф23 - УЛ. СВ.НИКОЛА НОВИ №8","ПАСТА ЗА ЗЪБИ ELMEX SENSITIVE PROFESSIONAL ZINK 75 МЛ","176010","81","5.36",""
"68134","Ф23 - УЛ. СВ.НИКОЛА НОВИ №8","ПАСТА ЗА ЗЪБИ SENSODYNE CLINICAL REPAIR WHITE 75 МЛ","176019","81","5.57",""
"68134","Ф23 - УЛ. СВ.НИКОЛА НОВИ №8","ПАСТА ЗА ЗЪБИ SENSODYNE COMPLETE PROTECTION WHITE 75 МЛ","176020","81","5.57",""
"68134","Ф23 - УЛ. СВ.НИКОЛА НОВИ №8","ПАСТА ЗА ЗЪБИ COLGATE MAX EXPERT PURIFYING POWER 75 МЛ","176023","81","5.60",""
"68134","Ф23 - УЛ. СВ.НИКОЛА НОВИ №8","ПАСТА ЗА ЗЪБИ COLGATE MAX WHITE SUPERIOR CLEAN 75 МЛ","176025","81","2.76",""
"68134","Ф23 - УЛ. СВ.НИКОЛА НОВИ №8","ПАСТА ЗА ЗЪБИ SENSODYNE CAVITY + SENSITIVITY 75 МЛ","176045","81","4.09","2.99"
"68134","Ф23 - УЛ. СВ.НИКОЛА НОВИ №8","ПАСТА ЗА ЗЪБИ SENSODYNE MULTI PROTECTION WHITE 75 МЛ ДАР","176056","81","4.28",""
"68134","Ф23 - УЛ. СВ.НИКОЛА НОВИ №8","ПАСТА ЗА ЗЪБИ COLGATE MAX FRESH CLEAN MINT 100 МЛ ДАР","176057","81","2.99",""
"68134","Ф23 - УЛ. СВ.НИКОЛА НОВИ №8","ПАСТА ЗА ЗЪБИ COLGATE MAX WHITENING CRYSTALS 100 МЛ ДАР","176058","81","2.99",""
"68134","Ф23 - УЛ. СВ.НИКОЛА НОВИ №8","ШАМПОАН BOTANIC THERAPY МАСЛО ОТ АВОКАДО И ШИЙ 400 МЛ","176648","82","5.36",""
"68134","Ф23 - УЛ. СВ.НИКОЛА НОВИ №8","ШАМПОАН NIVEA MEN SENSITIVE 250 МЛ","176695","82","5.04",""
"68134","Ф23 - УЛ. СВ.НИКОЛА НОВИ №8","ВИНО ЧЕРГА ЧЕРВЕНО 750 МЛ ДОМЕЙН МЕНАДА","190137","76","7.15","5.99"
"68134","Ф23 - УЛ. СВ.НИКОЛА НОВИ №8","ВИНО ШАРДОНЕ КОНТЕМПЛЕЙШЪНС 750 МЛ","190144","75","10.22",""
"68134","Ф23 - УЛ. СВ.НИКОЛА НОВИ №8","ВИНО ШАРДОНЕ ANGEL 750 МЛ ЕЙНДЖЪЛС ЕСТЕЙТ","190217","75","8.18",""
"68134","Ф23 - УЛ. СВ.НИКОЛА НОВИ №8","ВИНО МАВРУД БОЛГАРЕ 750 МЛ ДОМЕЙН БОЙАР","190231","76","4.09",""
"68134","Ф23 - УЛ. СВ.НИКОЛА НОВИ №8","ВИНО ШАРДОНЕ БОЛГАРЕ 750 МЛ ДОМЕЙН БОЙАР","190232","75","4.09",""
"68134","Ф23 - УЛ. СВ.НИКОЛА НОВИ №8","ВИНО КАБЕРНЕ СОВ. ШЕВАЛ ДЕ КАТАРЖИНА 750 МЛ","190238","76","7.41",""
"68134","Ф23 - УЛ. СВ.НИКОЛА НОВИ №8","ВИНО БОЛГАРЕ МУСКАТ 750 МЛ ДОМЕЙН БОЙАР","190242","75","4.09",""
"68134","Ф23 - УЛ. СВ.НИКОЛА НОВИ №8","БАНИЦА С ИЗВАРА 140 ГР ВЕНИ И МАР ДАР","292393","68","1.22",""
"68134","Ф23 - УЛ. СВ.НИКОЛА НОВИ №8","ВИНО МАВРУД БУТИК 750 МЛ ТОДОРОВ","570219","76","8.69",""
"68134","Ф23 - УЛ. СВ.НИКОЛА НОВИ №8","ВИНО МЕРЛО БУТИК 750 МЛ ТОДОРОВ","570221","76","8.69",""
"68134","Ф24 - БУЛ. ТОДОРИНИ КУКЛИ МЕЖДУ БЛ.96-97","ГЪБИ ПЕЧУРКИ КЛАС I ПР-Д ПОЛША КГ ДАР","001058","60","4.59",""
"68134","Ф24 - БУЛ. ТОДОРИНИ КУКЛИ МЕЖДУ БЛ.96-97","СИРЕНЕ КРАВЕ Ф ВКУС ВАКУУМ БЯЛО САЛАМУРЕНО","001562","9","5.99",""
"68134","Ф24 - БУЛ. ТОДОРИНИ КУКЛИ МЕЖДУ БЛ.96-97","КАШКАВАЛ ОТ КРАВЕ МЛЯКО Ф ВКУС НАСИПЕН Б-Я","001567","10","7.66",""
"68134","Ф24 - БУЛ. ТОДОРИНИ КУКЛИ МЕЖДУ БЛ.96-97","ВРАТ СВИНСКИ С КОСТ ПР-Д БЪЛГАРИЯ ПЕПИ КОМЕС ДАР, ПР-Д БЪЛГА","001800","21","6.13",""
"68134","Ф24 - БУЛ. ТОДОРИНИ КУКЛИ МЕЖДУ БЛ.96-97","ШОЛ ТЕЛЕШКИ  ПЕПИ КОМЕРС ДАР, ПР-Д БЪЛГАРИЯ","001815","23","16.36",""
"68134","Ф24 - БУЛ. ТОДОРИНИ КУКЛИ МЕЖДУ БЛ.96-97","ХАПКИ ТЕЛЕШКИ ПЕПИ КОМЕРС ДАР, ПР-Д БЪЛГАРИЯ","001820","24","12.78","11.79"
"68134","Ф24 - БУЛ. ТОДОРИНИ КУКЛИ МЕЖДУ БЛ.96-97","БУТ СВИНСКИ БЕЗ КОСТ БИЛЯНА-МЕС ДАР, ПР-Д БЪЛГАРИЯ","001832","19","6.08",""
"68134","Ф24 - БУЛ. ТОДОРИНИ КУКЛИ МЕЖДУ БЛ.96-97","МАСЛО КРАВЕ DEUTSCHE MARKENBUTTER 250 ГР КРАВАРКА","001841","12","3.78",""
"68134","Ф24 - БУЛ. ТОДОРИНИ КУКЛИ МЕЖДУ БЛ.96-97","МАСЛО КРАВЕ ФРЕНСКО PRESIDENT 250 ГР ПАКЕТ","001895","12","7.89",""
"68134","Ф24 - БУЛ. ТОДОРИНИ КУКЛИ МЕЖДУ БЛ.96-97","ВРАТ СВИНСКИ С КОСТ ПРОИЗХОД БЪЛГАРИЯ БИЛЯНА-МЕС","001927","21","6.39",""
"68134","Ф24 - БУЛ. ТОДОРИНИ КУКЛИ МЕЖДУ БЛ.96-97","ВРАТ СВИНСКИ БЕЗ КОСТ ПЕПИ КОМЕРС ПР-Д Б-Я КГ ДАР","001936","21","7.66",""
"68134","Ф24 - БУЛ. ТОДОРИНИ КУКЛИ МЕЖДУ БЛ.96-97","ПЛЕШКА СВИНСКА БЕЗ КОСТ ПЕПИ КОМЕРС ПР-Д Б-Я КГ ДАР","001938","18","6.13",""
"68134","Ф24 - БУЛ. ТОДОРИНИ КУКЛИ МЕЖДУ БЛ.96-97","БУТ СВИНСКИ БЕЗ КОСТ ПЕПИ КОМЕРС ПР-Д Б-Я КГ ДАР","001939","19","6.08",""
"68134","Ф24 - БУЛ. ТОДОРИНИ КУКЛИ МЕЖДУ БЛ.96-97","БУТ СВИНСКИ БЕЗ КОСТ БИЛЯНА-МЕС ДАР, ПР-Д БЪЛГАРИЯ","001998","19","6.08",""
"68134","Ф24 - БУЛ. ТОДОРИНИ КУКЛИ МЕЖДУ БЛ.96-97","ПЛЕШКА СВИНСКА БЕЗ КОСТ БИЛЯНА-МЕС ДАР, ПР-Д БЪЛГАРИЯ","001999","18","6.13",""
"68134","Ф24 - БУЛ. ТОДОРИНИ КУКЛИ МЕЖДУ БЛ.96-97","ВРАТ СВИНСКИ С КОСТ ПРОИЗХОД БЪЛГАРИЯ МК БРАТЯ РАДЕВИ","002013","21","6.39",""
"68134","Ф24 - БУЛ. ТОДОРИНИ КУКЛИ МЕЖДУ БЛ.96-97","МЛЯКО ПРЯСНО ВЕРЕЯ 3% 1 Л","002036","6","1.78",""
"68134","Ф24 - БУЛ. ТОДОРИНИ КУКЛИ МЕЖДУ БЛ.96-97","СКУМРИЯ ЦЯЛА DAGAMA 300/500 ЗАМР. КГ ПАКЕТ","003516","29","6.13",""
"68134","Ф24 - БУЛ. ТОДОРИНИ КУКЛИ МЕЖДУ БЛ.96-97","ХЛЯБ ДОБРУДЖА НАРЯЗАН 830 ГР СИМИД","003522","2","1.27",""
"68134","Ф24 - БУЛ. ТОДОРИНИ КУКЛИ МЕЖДУ БЛ.96-97","КАШКАВАЛ ОТ КРАВЕ МЛЯКО НАБОРЪ НАСИПЕН Б-Я","003599","10","8.79",""
"68134","Ф24 - БУЛ. ТОДОРИНИ КУКЛИ МЕЖДУ БЛ.96-97","МАКАРОНИ MELISSA ФУСИЛИ 500 ГР","004043","36","1.73","0.99"
"68134","Ф24 - БУЛ. ТОДОРИНИ КУКЛИ МЕЖДУ БЛ.96-97","СПАГЕТИ СТЕЛА НОМЕР 10 500 ГР","004114","37","1.53",""
"68134","Ф24 - БУЛ. ТОДОРИНИ КУКЛИ МЕЖДУ БЛ.96-97","МАКАРОНИ СТЕЛА МИДИЧКИ 500 ГР АХИВАДАКИ","004121","36","1.53",""
"68134","Ф24 - БУЛ. ТОДОРИНИ КУКЛИ МЕЖДУ БЛ.96-97","МАКАРОНИ СТЕЛА ФУСИЛИ 500 ГР ВИДЕС","004122","36","1.53",""
"68134","Ф24 - БУЛ. ТОДОРИНИ КУКЛИ МЕЖДУ БЛ.96-97","ЯБЪЛКИ ШАРЕНИ П-Д ПОЛША КЛАС I","004170","53","1.29",""
"68134","Ф24 - БУЛ. ТОДОРИНИ КУКЛИ МЕЖДУ БЛ.96-97","ЯБЪЛКИ ЗЕЛЕНИ КЛАС I ПР-Д ИТАЛИЯ КГ ДАР","004244","53","2.33",""
"68134","Ф24 - БУЛ. ТОДОРИНИ КУКЛИ МЕЖДУ БЛ.96-97","ЯБЪЛКИ ЧЕРВЕНИ ЕКСТРА КЛАС I ПР-Д ИТАЛИЯ КГ ДАР","004290","53","2.33",""
"68134","Ф24 - БУЛ. ТОДОРИНИ КУКЛИ МЕЖДУ БЛ.96-97","ЯБЪЛКИ ЗЛАТНИ ЕКСТРА КЛАС I ПР-Д ИТАЛИЯ КГ ДАР","004291","53","2.33",""
