"Населено място","Търговски обект","Наименование на продукта","Код на продукта","Категория","Цена на дребно","Цена в промоция"
"68134","Ф25 - УЛ. БУЗЛУДЖА №50","ХЛЯБ БЯЛ Ф ВКУС НАРЯЗАН 650 ГР","135270","1","0.76",""
"68134","Ф25 - УЛ. БУЗЛУДЖА №50","ОЛИО СЛЪНЧОГЛЕДОВО Ф ВКУС 1 Л РЕТ","135371","42","1.68",""
"68134","Ф25 - УЛ. БУЗЛУДЖА №50","ДОМАТИ Ф ВКУС БЕЛЕНИ НА КУБЧЕТА 400 ГР КОНСЕРВА IMPORT","135609","48","0.92",""
"68134","Ф25 - УЛ. БУЗЛУДЖА №50","МЛЯКО КИСЕЛО Ф ВКУС 2% 400 ГР","135625","7","0.49",""
"68134","Ф25 - УЛ. БУЗЛУДЖА №50","МЛЯКО КИСЕЛО Ф ВКУС 3.6% 400 ГР","135626","7","0.51",""
"68134","Ф25 - УЛ. БУЗЛУДЖА №50","МЛЯКО ПРЯСНО Ф ВКУС 3% 1 Л БУТИЛКА","135712","6","1.43",""
"68134","Ф25 - УЛ. БУЗЛУДЖА №50","КАШКАВАЛ ОТ КРАВЕ МЛЯКО Ф ВКУС 400 ГР ВАКУУМ","135731","11","3.57",""
"68134","Ф25 - УЛ. БУЗЛУДЖА №50","ДОМАТИ Ф ВКУС БЕЛЕНИ ЦЕЛИ 400 ГР IMPORT","135732","48","0.92",""
"68134","Ф25 - УЛ. БУЗЛУДЖА №50","БОБ Ф ВКУС БЯЛ 570 ГР БУРКАН IMPORT","135738","46","1.43",""
"68134","Ф25 - УЛ. БУЗЛУДЖА №50","БОБ Ф ВКУС БЯЛ СЪС ЗЕЛЕНЧУЦИ 540 ГР БУРКАН IMPORT","135739","46","1.53",""
"68134","Ф25 - УЛ. БУЗЛУДЖА №50","БОБ Ф ВКУС ЧЕРВЕН 570 ГР БУРКАН IMPORT","135740","46","1.43",""
"68134","Ф25 - УЛ. БУЗЛУДЖА №50","ЛЮТЕНИЦА Ф ВКУС ЕДРОСМЛЯНА 560 ГР БУРКАН","135752","49","2.55",""
"68134","Ф25 - УЛ. БУЗЛУДЖА №50","БОБ Ф ВКУС БЯЛ 400 Г IMPORT","135753","46","0.79",""
"68134","Ф25 - УЛ. БУЗЛУДЖА №50","БОБ Ф ВКУС ЧЕРВЕН 400 Г IMPORT","135754","46","0.79",""
"68134","Ф25 - УЛ. БУЗЛУДЖА №50","ХЛЯБ ЗАНАЯТЧИЙСКИ НЕМСКИ РЪЖЕНО ПШЕНИЧЕН 500 ГР ДОБРУДЖА","138345","3","1.48",""
"68134","Ф25 - УЛ. БУЗЛУДЖА №50","ХЛЯБ СЕЛСКИ БЯЛ 600 ГР СИМИД","138418","1","1.32",""
"68134","Ф25 - УЛ. БУЗЛУДЖА №50","** БАНИЦА ВИТА 180 ГР ИВ-АН","138462","68","1.35",""
"68134","Ф25 - УЛ. БУЗЛУДЖА №50","БАНИЦА С ИЗВАРА 420 ГР ВЕН И МАР ДАР","138606","68","2.96","2.19"
"68134","Ф25 - УЛ. БУЗЛУДЖА №50","** ХЛЯБ СЕЛСКИ РЪЖЕН 450 ГР ЛАГАРД","138796","3","1.84",""
"68134","Ф25 - УЛ. БУЗЛУДЖА №50","БАНИЦА ПРАВА 240 ГР ТРАКИЙСКА БАНИЦА ДАР","138909","68","1.43",""
"68134","Ф25 - УЛ. БУЗЛУДЖА №50","БАНИЦА ТРИЪГЪЛНА 240 ГР ТРАКИЙСКА БАНИЦА ДАР","138910","68","1.43","0.89"
"68134","Ф25 - УЛ. БУЗЛУДЖА №50","ХЛЯБ РЪЖЕНО - ПШЕНИЧЕН 600 ГР СИМИД","138926","3","1.17","0.89"
"68134","Ф25 - УЛ. БУЗЛУДЖА №50","ХЛЯБ ДОБРУДЖА 650 ГР МИО","138929","2","0.95",""
"68134","Ф25 - УЛ. БУЗЛУДЖА №50","БАНИЦА ВИТА 180 Г ДАНИ И НИКОЛ","138948","68","1.69",""
"68134","Ф25 - УЛ. БУЗЛУДЖА №50","ХЛЯБ СЕЛСКИ ТИПОВ С КВАС НАРЯЗАН 600 Г ЕЛИАЗ","138980","4","1.27",""
"68134","Ф25 - УЛ. БУЗЛУДЖА №50","ХЛЯБ 100% РЪЖ 400 ГР ЕЛИАЗ ДАР","139215","3","1.53",""
"68134","Ф25 - УЛ. БУЗЛУДЖА №50","БАНИЧКА СЪС СИРЕНЕ, ИЗВАРА И СПАНАК БЕЛЛА 120 ГР","139267","68","0.97",""
"68134","Ф25 - УЛ. БУЗЛУДЖА №50","БАНИЧКА СЪС СИРЕНЕ И ИЗВАРА БЕЛЛА 120 ГР","139268","68","0.97",""
"68134","Ф25 - УЛ. БУЗЛУДЖА №50","ХЛЯБ ДОБРУДЖА НАРЯЗАН УТВЪРДЕН СТАНДАРТ 650 ГР ЕЛИАЗ","139516","2","1.22",""
"68134","Ф25 - УЛ. БУЗЛУДЖА №50","ХЛЯБ ДОБРУДЖА НАРЯЗАН 500 ГР СИМИД","139876","2","0.92",""
"68134","Ф25 - УЛ. БУЗЛУДЖА №50","КРОАСАН BAULI ШОКОЛАД 50 ГР","155277","67","0.84","0.75"
"68134","Ф25 - УЛ. БУЗЛУДЖА №50","КРОАСАН SERENATA MAX С КАКАО 70 ГР","155281","67","0.66",""
"68134","Ф25 - УЛ. БУЗЛУДЖА №50","КРОАСАНИ ШОКО 7 DAYS КАКАО 60 ГР ЧИПИТА","155327","67","1.12",""
"68134","Ф25 - УЛ. БУЗЛУДЖА №50","БИСКВИТИ ЖИТЕН ДАР ОБИКНОВЕНИ 220 ГР","155686","66","1.27",""
"68134","Ф25 - УЛ. БУЗЛУДЖА №50","БИСКВИТИ ЖИТЕН ДАР PETIT BEURRE 220 ГР","155687","66","1.38",""
"68134","Ф25 - УЛ. БУЗЛУДЖА №50","БИСКВИТИ ОБИКНОВЕНИ ЖИТЕН ДАР 120 ГР","155688","66","0.84",""
"68134","Ф25 - УЛ. БУЗЛУДЖА №50","ШОКОЛАД 290 БЕЗ ГЛУТЕН СЪС СТЕВИЯ НИСКОКАЛОРИЧЕН 80 ГР МИЛМЕ","156038","69","3.37",""
"68134","Ф25 - УЛ. БУЗЛУДЖА №50","БИСКВИТИ ОБИКНОВЕНИ ДЕТСТВО МОЕ 200 ГР КАРМЕЛА","156632","66","1.12","1.00"
"68134","Ф25 - УЛ. БУЗЛУДЖА №50","БИСКВИТИ ОБИКНОВЕНИ ИЗГРЕВ ПОБЕДА 182 ГР","156652","66","0.97",""
"68134","Ф25 - УЛ. БУЗЛУДЖА №50","БИСКВИТИ ОБИКНОВЕНИ ПТИ БЬОР 225 ГР ПАПАДОПОЛУС","161308","66","1.22",""
"68134","Ф25 - УЛ. БУЗЛУДЖА №50","БИСКВИТИ ОБИКНОВЕНИ ПТИ БЬОР ПЪЛНОЗ. 225 ГР ПАПАДО","161309","66","1.22",""
"68134","Ф25 - УЛ. БУЗЛУДЖА №50","КРОАСАН MILKA ШОКОЛАД 50 ГР","161389","67","1.12",""
"68134","Ф25 - УЛ. БУЗЛУДЖА №50","ШОКОЛАД MILKA МЛЕЧЕН 90 ГР","161456","69","1.99",""
"68134","Ф25 - УЛ. БУЗЛУДЖА №50","ШОКОЛАД МЛЕЧЕН LINDT LINDOR 100 Г","161498","69","2.99",""
"68134","Ф25 - УЛ. БУЗЛУДЖА №50","ДОМАТИ БИО HARMONICA ПАСИРАНИ 680 ГР","163530","48","3.06",""
"68134","Ф25 - УЛ. БУЗЛУДЖА №50","ШОКОЛАД ROSHEN АЕРО МЛЕЧЕН 80 ГР КАСИ","164274","69","1.49",""
"68134","Ф25 - УЛ. БУЗЛУДЖА №50","КРОАСАН IQ КРЕМ ЛЕШНИК И КАКАО 110 ГР","164661","67","0.92",""
"68134","Ф25 - УЛ. БУЗЛУДЖА №50","ШОКОЛАД МЛЕЧЕН 80 ГР  КАСИ","165019","69","1.27",""
"68134","Ф25 - УЛ. БУЗЛУДЖА №50","ШОКОЛАД MERCI МЛЕЧЕН 100 ГР","165114","69","3.06","2.75"
"68134","Ф25 - УЛ. БУЗЛУДЖА №50","ШОКОЛАД LACMI МЛЕЧЕН 90 ГР","165289","69","1.69","0.79"
"68134","Ф25 - УЛ. БУЗЛУДЖА №50","КРОАСАН BELINO КРЕМ КАКАО 80 ГР","165711","67","0.61","0.51"
"68134","Ф25 - УЛ. БУЗЛУДЖА №50","БИСКВИТИ ОБИКНОВЕНИ КРИСТАЛ С МАСЛО 130 ГР","165882","66","1.24",""
"68134","Ф25 - УЛ. БУЗЛУДЖА №50","КРОАСАН LOTTO КРЕМ КАКАО И ЛЕШНИК 110 ГР","166133","67","0.71",""
"68134","Ф25 - УЛ. БУЗЛУДЖА №50","КРОАСАН 7 DAYS МАКС КРЕМ БРЮЛЕ 92 ГР","166170","67","0.86","0.61"
"68134","Ф25 - УЛ. БУЗЛУДЖА №50","КРОАСАН 7 DAYS МАКС КРЕМ ВАНИЛИЯ И БИСКВИТИ 92 ГР","166171","67","0.86","0.61"
"68134","Ф25 - УЛ. БУЗЛУДЖА №50","КРОАСАН 7 DAYS МАКС ДАБЪЛ ВАНИЛИЯ И ВИШНА 92 ГР","166172","67","0.86","0.61"
"68134","Ф25 - УЛ. БУЗЛУДЖА №50","КРОАСАН 7 DAYS МАКС ДАБЪЛ ВАНИЛИЯ И ЯГОДА 92 ГР","166173","67","0.86","0.61"
"68134","Ф25 - УЛ. БУЗЛУДЖА №50","КРОАСАН 7 DAYS МАКС КРЕМ КАКАО 92 ГР","166174","67","0.86","0.61"
"68134","Ф25 - УЛ. БУЗЛУДЖА №50","КРОАСАН 7 DAYS МАКС ДАБЪЛ КАКАО И ВАНИЛИЯ 92 ГР","166175","67","0.86","0.61"
"68134","Ф25 - УЛ. БУЗЛУДЖА №50","КРОАСАН 7 DAYS МАКС КРЕМ ЛЕШНИК 92 ГР","166177","67","0.86","0.61"
"68134","Ф25 - УЛ. БУЗЛУДЖА №50","ШОКОЛАД LZ МЛЕЧЕН 36 ГР КАСИ","166228","69","1.02",""
"68134","Ф25 - УЛ. БУЗЛУДЖА №50","ШОКОЛАД СВОГЕ ФИН МЛЕЧЕН 80 ГР","166262","69","1.43",""
"68134","Ф25 - УЛ. БУЗЛУДЖА №50","КРОАСАН 7 DAYS СУПЕР МАКС ВАНИЛИЯ И ВИШНА 110 ГР","166966","67","1.02",""
"68134","Ф25 - УЛ. БУЗЛУДЖА №50","КРОАСАН 7 DAYS СУПЕР МАКС КАКАО 110 ГР","166967","67","1.02",""
"68134","Ф25 - УЛ. БУЗЛУДЖА №50","КРОАСАН 7 DAYS СУПЕР МАКС КАКАО И ВАНИЛИЯ 110 ГР","166968","67","1.02",""
"68134","Ф25 - УЛ. БУЗЛУДЖА №50","ШАМПОАН SCHAUMA ВЪЗСТАНОВЯВАНЕ 400 МЛ SCHWARZKOPF/HENKEL","168005","82","2.91",""
"68134","Ф25 - УЛ. БУЗЛУДЖА №50","ШАМПОАН ELSEVE ARGININE RESIST 400 МЛ","168062","82","7.39",""
"68134","Ф25 - УЛ. БУЗЛУДЖА №50","ШАМПОАН ELSEVE TOTAL REPAIR 5 250 МЛ LOREAL","168253","82","5.57",""
"68134","Ф25 - УЛ. БУЗЛУДЖА №50","ШАМПОАН FRUCTIS SOS REPAIR 400 МЛ LOREAL","168967","82","5.62","4.25"
"68134","Ф25 - УЛ. БУЗЛУДЖА №50","ШАМПОАН BOTANIC THERAPY МЕД И ПРОПОЛИС 400 МЛ","169091","82","5.36",""
"68134","Ф25 - УЛ. БУЗЛУДЖА №50","КОМПЛЕКТ САПУН DOVE ORIGINAL 4 БР X 90 Г","169153","83","3.98",""
"68134","Ф25 - УЛ. БУЗЛУДЖА №50","ШАМПОАН ELSEVE DREAM LONG 250 МЛ","169287","82","5.57",""
"68134","Ф25 - УЛ. БУЗЛУДЖА №50","ШАМПОАН ELSEVE DREAM LONG 400 МЛ","169288","82","7.39",""
"68134","Ф25 - УЛ. БУЗЛУДЖА №50","ШАМПОАН SYOSS KERATIN 440 МЛ","169474","82","4.34",""
"68134","Ф25 - УЛ. БУЗЛУДЖА №50","САПУН DOVE PINK 90 Г","169519","83","1.19",""
"68134","Ф25 - УЛ. БУЗЛУДЖА №50","САПУН ТЕО MILK DELICATE CARE 90 Г","169561","83","1.02",""
"68134","Ф25 - УЛ. БУЗЛУДЖА №50","САПУН ТЕО MILK SENSUAL CARE 90 Г","169565","83","1.02",""
"68134","Ф25 - УЛ. БУЗЛУДЖА №50","САПУН TESORI D ORIENTE БЯЛ МУСКУС 125 Г","169606","83","2.74",""
"68134","Ф25 - УЛ. БУЗЛУДЖА №50","САПУН TESORI D ORIENTE КИТАЙСКА ОРХИДЕЯ 125 Г","169607","83","2.74",""
"68134","Ф25 - УЛ. БУЗЛУДЖА №50","К-Т САПУН SAFEGUARD КЛАСИК 4БР Х 90Г","169653","83","4.19",""
"68134","Ф25 - УЛ. БУЗЛУДЖА №50","САПУН KRISPA ГЛИЦЕРИНОВ 100 Г","169698","83","1.82",""
"68134","Ф25 - УЛ. БУЗЛУДЖА №50","САПУН ENGLISH SOAP MEN САНД. ДЪРВО И АМБЪР 190 Г","169699","83","6.64","5.09"
"68134","Ф25 - УЛ. БУЗЛУДЖА №50","ШАМПОАН ELSEVE HYALURON 250 МЛ","169765","82","5.57",""
"68134","Ф25 - УЛ. БУЗЛУДЖА №50","ШАМПОАН ELSEVE HYALURON 400 МЛ","169766","82","7.39",""
"68134","Ф25 - УЛ. БУЗЛУДЖА №50","ШАМПОАН ALPECIN C1 КОФЕИНОВ 250 МЛ","169860","82","6.64","6.19"
"68134","Ф25 - УЛ. БУЗЛУДЖА №50","ШАМПОАН HEAD & SHOULDERS КЛАСИК 500 МЛ","169885","82","6.33",""
"68134","Ф25 - УЛ. БУЗЛУДЖА №50","ПРЕПАРАТ ЗА СЪДОВЕ ЕХО БАЛСАМ ЛАЙКА 400 МЛ","170925","79","1.49","1.15"
"68134","Ф25 - УЛ. БУЗЛУДЖА №50","САПУН DOVE DRAGON FRUIT 90 Г","172130","83","1.19",""
"68134","Ф25 - УЛ. БУЗЛУДЖА №50","ШАМПОАН WASH & GO БИЛКИ 360 МЛ","172245","82","3.98",""
"68134","Ф25 - УЛ. БУЗЛУДЖА №50","ШАМПОАН YVES ROCHER ЗА ОБЕМ 300 МЛ","172306","82","6.95",""
"68134","Ф25 - УЛ. БУЗЛУДЖА №50","ШАМПОАН YVES ROCHER ПРОТИВ КОСОПАД 300 МЛ","172308","82","6.95",""
"68134","Ф25 - УЛ. БУЗЛУДЖА №50","ШАМПОАН YVES ROCHER ПРОТИВ ПЪРХОТ 300 МЛ","172309","82","6.95",""
"68134","Ф25 - УЛ. БУЗЛУДЖА №50","* ШАМПОАН HEAD & SHOULDERS MENTHOL FRESH 330 МЛ","172765","82","5.11",""
"68134","Ф25 - УЛ. БУЗЛУДЖА №50","ШАМПОАН ЗА КОСА ELSEVE HYALURON PURE 250 МЛ","172767","82","5.57",""
"68134","Ф25 - УЛ. БУЗЛУДЖА №50","ШАМПОАН ЗА КОСА ELSEVE HYALURON PURE 400 МЛ","172768","82","7.39",""
"68134","Ф25 - УЛ. БУЗЛУДЖА №50","ШАМПОАН HEAD & SHOULDERS МЕНТОЛ 500 МЛ","172787","82","6.33",""
"68134","Ф25 - УЛ. БУЗЛУДЖА №50","ПАСТА ЗА ЗЪБИ COLGATE MAX WHITE PURPLE REVEAL 75 МЛ","172821","81","2.76",""
"68134","Ф25 - УЛ. БУЗЛУДЖА №50","ПАСТА ЗА ЗЪБИ PARODONTAX ACTIVE REPAIR FRESH MINT 75 МЛ","172836","81","4.80",""
"68134","Ф25 - УЛ. БУЗЛУДЖА №50","ПАСТА ЗА ЗЪБИ COLGATE MAX WHITE EXP ULTRA MULTIPURPOSE 50 МЛ","172851","81","5.60",""
"68134","Ф25 - УЛ. БУЗЛУДЖА №50","ПАСТА ЗА ЗЪБИ LACALUT ACTIV PLUS 75 МЛ","172874","81","5.87","3.79"
"68134","Ф25 - УЛ. БУЗЛУДЖА №50","ПАСТА ЗА ЗЪБИ SENSODYNE CLINICAL REPAIR 75 МЛ","172892","81","5.57",""
"68134","Ф25 - УЛ. БУЗЛУДЖА №50","ШАМПОАН PANTENE REPAIR PROTECT 400 МЛ","172920","82","7.15",""
"68134","Ф25 - УЛ. БУЗЛУДЖА №50","ПАСТА ЗА ЗЪБИ ELMEX SENSITIVE PLUS COMPLETE PTOTECTION 75 МЛ","176009","81","5.36",""
"68134","Ф25 - УЛ. БУЗЛУДЖА №50","ПАСТА ЗА ЗЪБИ SENSODYNE CLINICAL REPAIR WHITE 75 МЛ","176019","81","5.57",""
"68134","Ф25 - УЛ. БУЗЛУДЖА №50","ПАСТА ЗА ЗЪБИ COLGATE MAX FRESH CLEAN MINT 100 МЛ ДАР","176057","81","2.99",""
"68134","Ф25 - УЛ. БУЗЛУДЖА №50","ПАСТА ЗА ЗЪБИ COLGATE MAX WHITENING CRYSTALS 100 МЛ ДАР","176058","81","2.99",""
"68134","Ф25 - УЛ. БУЗЛУДЖА №50","ВИНО РЕДАРК 750 МЛ","190100","76","20.45",""
"68134","Ф25 - УЛ. БУЗЛУДЖА №50","ВИНО ДОБРА ГОДИНА ТРАМИНЕР ПИНК 750 МЛ МЕДИ ВАЛЕЙ","190102","75","6.13",""
"68134","Ф25 - УЛ. БУЗЛУДЖА №50","ВИНО МУСКАТ ГАЛЕРИЯ 750 МЛ ТОДОРОВ","190133","75","10.22",""
"68134","Ф25 - УЛ. БУЗЛУДЖА №50","ВИНО ЧЕРГА ЧЕРВЕНО 750 МЛ ДОМЕЙН МЕНАДА","190137","76","7.15","5.99"
"68134","Ф25 - УЛ. БУЗЛУДЖА №50","ВИНО ШАРДОНЕ ANGEL 750 МЛ ЕЙНДЖЪЛС ЕСТЕЙТ","190217","75","8.18",""
"68134","Ф25 - УЛ. БУЗЛУДЖА №50","ВИНО МАВРУД БОЛГАРЕ 750 МЛ ДОМЕЙН БОЙАР","190231","76","4.09",""
"68134","Ф25 - УЛ. БУЗЛУДЖА №50","ВИНО ШАРДОНЕ БОЛГАРЕ 750 МЛ ДОМЕЙН БОЙАР","190232","75","4.09",""
"68134","Ф25 - УЛ. БУЗЛУДЖА №50","ВИНО ШАРДОНЕ ШЕВАЛ ДЕ КАТАРЖИНА 750 МЛ","190236","75","7.41",""
"68134","Ф25 - УЛ. БУЗЛУДЖА №50","ВИНО КАБЕРНЕ СОВ. ШЕВАЛ ДЕ КАТАРЖИНА 750 МЛ","190238","76","7.41",""
"68134","Ф25 - УЛ. БУЗЛУДЖА №50","ВИНО ЧИФЛИК ЛИВАДИ ЧЕРВЕНО ОРГАНИК 750 МЛ","190269","76","12.27",""
"68134","Ф25 - УЛ. БУЗЛУДЖА №50","БАНИЦА С ИЗВАРА 140 ГР ВЕНИ И МАР ДАР","292393","68","1.22",""
"68134","Ф25 - УЛ. БУЗЛУДЖА №50","ВИНО МАВРУД БУТИК 750 МЛ ТОДОРОВ","570219","76","8.69",""
"68134","Ф25 - УЛ. БУЗЛУДЖА №50","ВИНО МЕРЛО БУТИК 750 МЛ ТОДОРОВ","570221","76","8.69",""
"41112","Ф29 - ГР. КЮСТЕНДИЛ УЛ.ЦАР ОСВОБОДИТЕЛ","ГЪБИ ПЕЧУРКИ КЛАС I ПР-Д ПОЛША КГ ДАР","001058","60","4.59",""
"41112","Ф29 - ГР. КЮСТЕНДИЛ УЛ.ЦАР ОСВОБОДИТЕЛ","МЛЯКО ПРЯСНО MEGGLE 3.2% 1 Л UHT","001102","6","1.89",""
"41112","Ф29 - ГР. КЮСТЕНДИЛ УЛ.ЦАР ОСВОБОДИТЕЛ","МАСЛО КРАВЕ PRESIDENT 125 ГР","001139","12","4.09",""
"41112","Ф29 - ГР. КЮСТЕНДИЛ УЛ.ЦАР ОСВОБОДИТЕЛ","НАДЕНИЦА ШУНКОВА ЕКСТРА МЕС ВИТРИНА ПР-Д БЪЛГАРИЯ ДАР","001185","27","6.39",""
"41112","Ф29 - ГР. КЮСТЕНДИЛ УЛ.ЦАР ОСВОБОДИТЕЛ","ЯЙЦА РАЗМЕР L 10 БР АНГЕЛОВ БЕЛИ 2 FARM","001475","32","3.59",""
"41112","Ф29 - ГР. КЮСТЕНДИЛ УЛ.ЦАР ОСВОБОДИТЕЛ","СИРЕНЕ КРАВЕ Ф ВКУС ВАКУУМ БЯЛО САЛАМУРЕНО","001562","9","5.99",""
"41112","Ф29 - ГР. КЮСТЕНДИЛ УЛ.ЦАР ОСВОБОДИТЕЛ","КАШКАВАЛ ОТ КРАВЕ МЛЯКО Ф ВКУС НАСИПЕН Б-Я","001567","10","7.66",""
"41112","Ф29 - ГР. КЮСТЕНДИЛ УЛ.ЦАР ОСВОБОДИТЕЛ","ФИЛЕ ПИЛЕ ОХЛАДЕНО НАСИПНО ГРАДУС ,ПРОИЗХОД БЪЛГАРИЯ","001598","16","7.15","5.59"
"41112","Ф29 - ГР. КЮСТЕНДИЛ УЛ.ЦАР ОСВОБОДИТЕЛ","ВРАТ СВИНСКИ С КОСТ ПР-Д БЪЛГАРИЯ ПЕПИ КОМЕС ДАР, ПР-Д БЪЛГА","001800","21","6.13",""
"41112","Ф29 - ГР. КЮСТЕНДИЛ УЛ.ЦАР ОСВОБОДИТЕЛ","ШОЛ ТЕЛЕШКИ  ПЕПИ КОМЕРС ДАР, ПР-Д БЪЛГАРИЯ","001815","23","16.36",""
"41112","Ф29 - ГР. КЮСТЕНДИЛ УЛ.ЦАР ОСВОБОДИТЕЛ","ХАПКИ ТЕЛЕШКИ ПЕПИ КОМЕРС ДАР, ПР-Д БЪЛГАРИЯ","001820","24","12.78","11.79"
"41112","Ф29 - ГР. КЮСТЕНДИЛ УЛ.ЦАР ОСВОБОДИТЕЛ","БУТ СВИНСКИ БЕЗ КОСТ БИЛЯНА-МЕС ДАР, ПР-Д БЪЛГАРИЯ","001832","19","6.08",""
"41112","Ф29 - ГР. КЮСТЕНДИЛ УЛ.ЦАР ОСВОБОДИТЕЛ","МАСЛО КРАВЕ DEUTSCHE MARKENBUTTER 250 ГР КРАВАРКА","001841","12","3.78",""
"41112","Ф29 - ГР. КЮСТЕНДИЛ УЛ.ЦАР ОСВОБОДИТЕЛ","ВРАТ СВИНСКИ БЕЗ КОСТ МАРИНОВАН ПР-Д БЪЛГАРИЯ ДАР","001862","21","8.18",""
"41112","Ф29 - ГР. КЮСТЕНДИЛ УЛ.ЦАР ОСВОБОДИТЕЛ","МАСЛО КРАВЕ ФРЕНСКО PRESIDENT 250 ГР ПАКЕТ","001895","12","7.89",""
"41112","Ф29 - ГР. КЮСТЕНДИЛ УЛ.ЦАР ОСВОБОДИТЕЛ","ВРАТ СВИНСКИ БЕЗ КОСТ МЕХ. ОКРЕХКОТЕН F МЕСАР ПР-Д Б-Я ДАР","001926","21","8.18",""
"41112","Ф29 - ГР. КЮСТЕНДИЛ УЛ.ЦАР ОСВОБОДИТЕЛ","ВРАТ СВИНСКИ С КОСТ ПРОИЗХОД БЪЛГАРИЯ БИЛЯНА-МЕС","001927","21","6.39",""
"41112","Ф29 - ГР. КЮСТЕНДИЛ УЛ.ЦАР ОСВОБОДИТЕЛ","ВРАТ СВИНСКИ БЕЗ КОСТ ПЕПИ КОМЕРС ПР-Д Б-Я КГ ДАР","001936","21","7.66",""
"41112","Ф29 - ГР. КЮСТЕНДИЛ УЛ.ЦАР ОСВОБОДИТЕЛ","ПЛЕШКА СВИНСКА БЕЗ КОСТ ПЕПИ КОМЕРС ПР-Д Б-Я КГ ДАР","001938","18","6.13",""
"41112","Ф29 - ГР. КЮСТЕНДИЛ УЛ.ЦАР ОСВОБОДИТЕЛ","ВРАТ СВИНСКИ С КОСТ ПРОИЗХОД БЪЛГАРИЯ МК БРАТЯ РАДЕВИ","002013","21","6.39",""
"41112","Ф29 - ГР. КЮСТЕНДИЛ УЛ.ЦАР ОСВОБОДИТЕЛ","МЛЯКО ПРЯСНО ВЕРЕЯ 3% 1 Л","002036","6","1.78",""
"41112","Ф29 - ГР. КЮСТЕНДИЛ УЛ.ЦАР ОСВОБОДИТЕЛ","МЛЯКО КИСЕЛО РОДОПЕЯ 3.6%  500 ГР","002084","7","0.84",""
"41112","Ф29 - ГР. КЮСТЕНДИЛ УЛ.ЦАР ОСВОБОДИТЕЛ","ПЪСТЪРВА ЧИСТЕНА ПР-Д БЪЛГАРИЯ КГ ОХЛ. МОРСКИ ДАР ДАР","002617","30","7.99","5.99"
"41112","Ф29 - ГР. КЮСТЕНДИЛ УЛ.ЦАР ОСВОБОДИТЕЛ","СКУМРИЯ ЧИСТЕНА ПР-Д НОРВЕГИЯ КГ РАЗМР. МОРСКИ ДАР ДАР","002621","30","6.64",""
"41112","Ф29 - ГР. КЮСТЕНДИЛ УЛ.ЦАР ОСВОБОДИТЕЛ","СКУМРИЯ ЦЯЛА DAGAMA 300/500 ЗАМР. КГ ПАКЕТ","003516","29","6.13",""
"41112","Ф29 - ГР. КЮСТЕНДИЛ УЛ.ЦАР ОСВОБОДИТЕЛ","ХЛЯБ ДОБРУДЖА НАРЯЗАН 830 ГР СИМИД","003522","2","1.27",""
"41112","Ф29 - ГР. КЮСТЕНДИЛ УЛ.ЦАР ОСВОБОДИТЕЛ","КАШКАВАЛ ОТ КРАВЕ МЛЯКО НАБОРЪ НАСИПЕН Б-Я","003599","10","8.79",""
"41112","Ф29 - ГР. КЮСТЕНДИЛ УЛ.ЦАР ОСВОБОДИТЕЛ","СКУМРИЯ ГЛАВА 300/500 НОРВЕЖКА  КГ ЗАМР.ПАКЕТ МОРСКИ ДАР ДАР","003837","29","5.82",""
"41112","Ф29 - ГР. КЮСТЕНДИЛ УЛ.ЦАР ОСВОБОДИТЕЛ","СКУМРИЯ ЧИСТЕНА  КГ ЗАМРАЗЕНА ПАКЕТ МОРСКИ ДАР ДАР","003839","29","7.05",""
"41112","Ф29 - ГР. КЮСТЕНДИЛ УЛ.ЦАР ОСВОБОДИТЕЛ","МАКАРОНИ MELISSA ФУСИЛИ 500 ГР","004043","36","1.73","0.99"
"41112","Ф29 - ГР. КЮСТЕНДИЛ УЛ.ЦАР ОСВОБОДИТЕЛ","СПАГЕТИ СТЕЛА НОМЕР 10 500 ГР","004114","37","1.53",""
"41112","Ф29 - ГР. КЮСТЕНДИЛ УЛ.ЦАР ОСВОБОДИТЕЛ","МАКАРОНИ СТЕЛА ОРЗО 500 ГР АРПА ФИДЕ","004118","36","1.53",""
"41112","Ф29 - ГР. КЮСТЕНДИЛ УЛ.ЦАР ОСВОБОДИТЕЛ","МАКАРОНИ СТЕЛА ЗВЕЗДИЧКИ 500 ГР","004119","36","1.53",""
"41112","Ф29 - ГР. КЮСТЕНДИЛ УЛ.ЦАР ОСВОБОДИТЕЛ","МАКАРОНИ СТЕЛА ПРУЖИНИ 500 ГР АМОРОЗО","004120","36","1.53",""
"41112","Ф29 - ГР. КЮСТЕНДИЛ УЛ.ЦАР ОСВОБОДИТЕЛ","МАКАРОНИ СТЕЛА МИДИЧКИ 500 ГР АХИВАДАКИ","004121","36","1.53",""
"41112","Ф29 - ГР. КЮСТЕНДИЛ УЛ.ЦАР ОСВОБОДИТЕЛ","МАКАРОНИ СТЕЛА ФУСИЛИ 500 ГР ВИДЕС","004122","36","1.53",""
"41112","Ф29 - ГР. КЮСТЕНДИЛ УЛ.ЦАР ОСВОБОДИТЕЛ","МАКАРОНИ СТЕЛА ТРОМПЕТИНИ 500 ГР","004123","36","1.53",""
"41112","Ф29 - ГР. КЮСТЕНДИЛ УЛ.ЦАР ОСВОБОДИТЕЛ","МАКАРОНИ СТЕЛА КОРАЛИ 500 ГР","004124","36","1.53",""
"41112","Ф29 - ГР. КЮСТЕНДИЛ УЛ.ЦАР ОСВОБОДИТЕЛ","МАКАРОНИ СТЕЛА ПЕНЕ 500 ГР","004125","36","1.53",""
"41112","Ф29 - ГР. КЮСТЕНДИЛ УЛ.ЦАР ОСВОБОДИТЕЛ","ЯБЪЛКИ ШАРЕНИ П-Д ПОЛША КЛАС I","004170","53","1.29",""
"41112","Ф29 - ГР. КЮСТЕНДИЛ УЛ.ЦАР ОСВОБОДИТЕЛ","ЯБЪЛКИ ЗЕЛЕНИ КЛАС I ПР-Д ИТАЛИЯ КГ ДАР","004244","53","2.33",""
"41112","Ф29 - ГР. КЮСТЕНДИЛ УЛ.ЦАР ОСВОБОДИТЕЛ","ЯБЪЛКИ ЧЕРВЕНИ ЕКСТРА КЛАС I ПР-Д ИТАЛИЯ КГ ДАР","004290","53","2.33",""
"41112","Ф29 - ГР. КЮСТЕНДИЛ УЛ.ЦАР ОСВОБОДИТЕЛ","ЯБЪЛКИ ЗЛАТНИ ЕКСТРА КЛАС I ПР-Д ИТАЛИЯ КГ ДАР","004291","53","2.33",""
"41112","Ф29 - ГР. КЮСТЕНДИЛ УЛ.ЦАР ОСВОБОДИТЕЛ","КАРТОФИ МИТИ ПРОИЗХОД ФРАНЦИЯ ОПС","004312","61","0.81",""
"41112","Ф29 - ГР. КЮСТЕНДИЛ УЛ.ЦАР ОСВОБОДИТЕЛ","БАНАНИ КЛАС I ПРОИЗХОД ЕКВАДОР","004400","52","1.89",""
"41112","Ф29 - ГР. КЮСТЕНДИЛ УЛ.ЦАР ОСВОБОДИТЕЛ","КРАСТАВИЦИ СОРТ ГЕРГАНА КЛАС I ПР-Д БЪЛГАРИЯ КГ ДАР","004408","58","4.99",""
"41112","Ф29 - ГР. КЮСТЕНДИЛ УЛ.ЦАР ОСВОБОДИТЕЛ","ЛИМОНИ КЛАС I ПРОИЗХОД ТУРЦИЯ","004410","50","3.47",""
"41112","Ф29 - ГР. КЮСТЕНДИЛ УЛ.ЦАР ОСВОБОДИТЕЛ","ЛУК ЖЪЛТ ПРОИЗХОД УКРАЙНА ОПС","004426","55","0.64",""
"41112","Ф29 - ГР. КЮСТЕНДИЛ УЛ.ЦАР ОСВОБОДИТЕЛ","ПОРТОКАЛИ КЛАС I ПРОИЗХОД ЕГИПЕТ","004435","51","1.48",""
"41112","Ф29 - ГР. КЮСТЕНДИЛ УЛ.ЦАР ОСВОБОДИТЕЛ","КРАСТАВИЦИ ПРОИЗХОД БЪЛГАРИЯ ОПС","004456","58","2.29",""
"41112","Ф29 - ГР. КЮСТЕНДИЛ УЛ.ЦАР ОСВОБОДИТЕЛ","МОРКОВИ ПРОИЗХОД ГЪРЦИЯ ОПС","004467","56","1.05",""
"41112","Ф29 - ГР. КЮСТЕНДИЛ УЛ.ЦАР ОСВОБОДИТЕЛ","ЧЕСЪН ПРОИЗХОД ИСПАНИЯ ОПС","004646","59","4.69",""
"41112","Ф29 - ГР. КЮСТЕНДИЛ УЛ.ЦАР ОСВОБОДИТЕЛ","ДОМАТИ ЧЕРВЕНИ ПРОИЗХОД БЪЛГАРИЯ КЛАС I","004676","54","2.99",""
"41112","Ф29 - ГР. КЮСТЕНДИЛ УЛ.ЦАР ОСВОБОДИТЕЛ","КОРИ ТОЧЕНИ ФАМИЛИЯ 500 ГР","004737","5","2.19",""
"41112","Ф29 - ГР. КЮСТЕНДИЛ УЛ.ЦАР ОСВОБОДИТЕЛ","СПАГЕТИ MELISSA НОМЕР 10 500 ГР","004781","37","1.73","0.99"
