"Населено място","Търговски обект","Наименование на продукта","Код на продукта","Категория","Цена на дребно","Цена в промоция"
"41112","Ф29 - ГР. КЮСТЕНДИЛ УЛ.ЦАР ОСВОБОДИТЕЛ","БИСКВИТИ ОБИКНОВЕНИ РОДЕН КРАЙ 120 ГР","165662","66","0.86","0.73"
"41112","Ф29 - ГР. КЮСТЕНДИЛ УЛ.ЦАР ОСВОБОДИТЕЛ","КРОАСАН BELINO КРЕМ КАКАО 80 ГР","165711","67","0.61","0.51"
"41112","Ф29 - ГР. КЮСТЕНДИЛ УЛ.ЦАР ОСВОБОДИТЕЛ","КРОАСАН BELINO ЧЕРЕША 80 ГР","165712","67","0.61","0.51"
"41112","Ф29 - ГР. КЮСТЕНДИЛ УЛ.ЦАР ОСВОБОДИТЕЛ","БИСКВИТИ ОБИКНОВЕНИ КРИСТАЛ С МАСЛО 130 ГР","165882","66","1.24",""
"41112","Ф29 - ГР. КЮСТЕНДИЛ УЛ.ЦАР ОСВОБОДИТЕЛ","КРОАСАН LOTTO ВКУС ИТАЛИАНСКО ПЕНЛИВО ВИНО 110 ГР","166131","67","0.71",""
"41112","Ф29 - ГР. КЮСТЕНДИЛ УЛ.ЦАР ОСВОБОДИТЕЛ","КРОАСАН LOTTO КРЕМ КАКАО И ВАНИЛИЯ 110 ГР","166132","67","0.71",""
"41112","Ф29 - ГР. КЮСТЕНДИЛ УЛ.ЦАР ОСВОБОДИТЕЛ","КРОАСАН LOTTO КРЕМ КАКАО И ЛЕШНИК 110 ГР","166133","67","0.71",""
"41112","Ф29 - ГР. КЮСТЕНДИЛ УЛ.ЦАР ОСВОБОДИТЕЛ","КРОАСАН 7 DAYS МАКС КРЕМ БРЮЛЕ 92 ГР","166170","67","0.86","0.61"
"41112","Ф29 - ГР. КЮСТЕНДИЛ УЛ.ЦАР ОСВОБОДИТЕЛ","КРОАСАН 7 DAYS МАКС КРЕМ ВАНИЛИЯ И БИСКВИТИ 92 ГР","166171","67","0.86","0.61"
"41112","Ф29 - ГР. КЮСТЕНДИЛ УЛ.ЦАР ОСВОБОДИТЕЛ","КРОАСАН 7 DAYS МАКС ДАБЪЛ ВАНИЛИЯ И ВИШНА 92 ГР","166172","67","0.86","0.61"
"41112","Ф29 - ГР. КЮСТЕНДИЛ УЛ.ЦАР ОСВОБОДИТЕЛ","КРОАСАН 7 DAYS МАКС ДАБЪЛ ВАНИЛИЯ И ЯГОДА 92 ГР","166173","67","0.86","0.61"
"41112","Ф29 - ГР. КЮСТЕНДИЛ УЛ.ЦАР ОСВОБОДИТЕЛ","КРОАСАН 7 DAYS МАКС КРЕМ КАКАО 92 ГР","166174","67","0.86","0.61"
"41112","Ф29 - ГР. КЮСТЕНДИЛ УЛ.ЦАР ОСВОБОДИТЕЛ","КРОАСАН 7 DAYS МАКС ДАБЪЛ КАКАО И ВАНИЛИЯ 92 ГР","166175","67","0.86","0.61"
"41112","Ф29 - ГР. КЮСТЕНДИЛ УЛ.ЦАР ОСВОБОДИТЕЛ","КРОАСАН 7 DAYS МАКС КРЕМ ЛЕШНИК 92 ГР","166177","67","0.86","0.61"
"41112","Ф29 - ГР. КЮСТЕНДИЛ УЛ.ЦАР ОСВОБОДИТЕЛ","ШОКОЛАД LZ МЛЕЧЕН 36 ГР КАСИ","166228","69","1.02",""
"41112","Ф29 - ГР. КЮСТЕНДИЛ УЛ.ЦАР ОСВОБОДИТЕЛ","ШОКОЛАД СВОГЕ ФИН МЛЕЧЕН 80 ГР","166262","69","1.43",""
"41112","Ф29 - ГР. КЮСТЕНДИЛ УЛ.ЦАР ОСВОБОДИТЕЛ","БИСКВИТИ ОБИКНОВЕНИ НАЯ КАКАО 180 ГР","166480","66","1.22","1.05"
"41112","Ф29 - ГР. КЮСТЕНДИЛ УЛ.ЦАР ОСВОБОДИТЕЛ","БИСКВИТИ ОБИКНОВЕНИ НАЯ КЛАСИК 180 ГР","166481","66","1.22","1.05"
"41112","Ф29 - ГР. КЮСТЕНДИЛ УЛ.ЦАР ОСВОБОДИТЕЛ","КРОАСАН 22 CARATS КАКАОВ КРЕМ 55 ГР","166944","67","0.45",""
"41112","Ф29 - ГР. КЮСТЕНДИЛ УЛ.ЦАР ОСВОБОДИТЕЛ","КРОАСАН 7 DAYS СУПЕР МАКС ВАНИЛИЯ И ВИШНА 110 ГР","166966","67","1.02",""
"41112","Ф29 - ГР. КЮСТЕНДИЛ УЛ.ЦАР ОСВОБОДИТЕЛ","КРОАСАН 7 DAYS СУПЕР МАКС КАКАО 110 ГР","166967","67","1.02",""
"41112","Ф29 - ГР. КЮСТЕНДИЛ УЛ.ЦАР ОСВОБОДИТЕЛ","КРОАСАН 7 DAYS СУПЕР МАКС КАКАО И ВАНИЛИЯ 110 ГР","166968","67","1.02",""
"41112","Ф29 - ГР. КЮСТЕНДИЛ УЛ.ЦАР ОСВОБОДИТЕЛ","ШАМПОАН SCHAUMA МЪЖКИ 400 МЛ SCHWARZKOPF","168004","82","2.91",""
"41112","Ф29 - ГР. КЮСТЕНДИЛ УЛ.ЦАР ОСВОБОДИТЕЛ","ШАМПОАН SCHAUMA ВЪЗСТАНОВЯВАНЕ 400 МЛ SCHWARZKOPF/HENKEL","168005","82","2.91",""
"41112","Ф29 - ГР. КЮСТЕНДИЛ УЛ.ЦАР ОСВОБОДИТЕЛ","ШАМПОАН ELSEVE ARGININE RESIST 400 МЛ","168062","82","7.39",""
"41112","Ф29 - ГР. КЮСТЕНДИЛ УЛ.ЦАР ОСВОБОДИТЕЛ","ШАМПОАН SCHAUMA ИНТЕНЗИВЕН ПРОТИВ ПЪРХОТ МЪЖКИ 400 МЛ","168252","82","2.91",""
"41112","Ф29 - ГР. КЮСТЕНДИЛ УЛ.ЦАР ОСВОБОДИТЕЛ","ШАМПОАН ELSEVE TOTAL REPAIR 5 250 МЛ LOREAL","168253","82","5.57",""
"41112","Ф29 - ГР. КЮСТЕНДИЛ УЛ.ЦАР ОСВОБОДИТЕЛ","ШАМПОАН ELSEVE FULL RESIST 250 МЛ","168301","82","5.57",""
"41112","Ф29 - ГР. КЮСТЕНДИЛ УЛ.ЦАР ОСВОБОДИТЕЛ","ШАМПОАН SCHAUMA СПОРТ МЪЖКИ С КЕРАТИН 400 МЛ","168452","82","2.91",""
"41112","Ф29 - ГР. КЮСТЕНДИЛ УЛ.ЦАР ОСВОБОДИТЕЛ","ШАМПОАН ELSEVE EXTRAORDINARY OIL 250 МЛ","168590","82","5.57",""
"41112","Ф29 - ГР. КЮСТЕНДИЛ УЛ.ЦАР ОСВОБОДИТЕЛ","ШАМПОАН SCHAUMA ОСВЕЖИ СЕ 400 МЛ","168607","82","2.91",""
"41112","Ф29 - ГР. КЮСТЕНДИЛ УЛ.ЦАР ОСВОБОДИТЕЛ","ШАМПОАН ЗДРАВЕ АКТИВ СТИМУЛИРАЩ 390/400 МЛ","168714","82","5.11",""
"41112","Ф29 - ГР. КЮСТЕНДИЛ УЛ.ЦАР ОСВОБОДИТЕЛ","ШАМПОАН ЗДРАВЕ АКТИВ ДЪЛБОКО ПОЧИСТВАЩ 390/400 МЛ","168715","82","5.11",""
"41112","Ф29 - ГР. КЮСТЕНДИЛ УЛ.ЦАР ОСВОБОДИТЕЛ","ШАМПОАН ЗДРАВЕ АКТИВ ЕНЕРГИЗИРАЩ 390/400 МЛ","168716","82","5.11",""
"41112","Ф29 - ГР. КЮСТЕНДИЛ УЛ.ЦАР ОСВОБОДИТЕЛ","ШАМПОАН FRUCTIS SOS REPAIR 250 МЛ LOREAL","168955","82","4.44","2.69"
"41112","Ф29 - ГР. КЮСТЕНДИЛ УЛ.ЦАР ОСВОБОДИТЕЛ","ШАМПОАН FRUCTIS GROW STRONG 400МЛ LOREAL","168959","82","5.62","4.25"
"41112","Ф29 - ГР. КЮСТЕНДИЛ УЛ.ЦАР ОСВОБОДИТЕЛ","ШАМПОАН FRUCTIS SOS REPAIR 400 МЛ LOREAL","168967","82","5.62","4.25"
"41112","Ф29 - ГР. КЮСТЕНДИЛ УЛ.ЦАР ОСВОБОДИТЕЛ","ШАМПОАН ЗДРАВЕ ДЕТОКСИКИРАЩ 390/400 МЛ","169042","82","5.11",""
"41112","Ф29 - ГР. КЮСТЕНДИЛ УЛ.ЦАР ОСВОБОДИТЕЛ","ШАМПОАН GLISS SUPREME LENGHT 250 МЛ","169046","82","4.58",""
"41112","Ф29 - ГР. КЮСТЕНДИЛ УЛ.ЦАР ОСВОБОДИТЕЛ","ШАМПОАН BOTANIC THERAPY МЕД И ПРОПОЛИС 250 МЛ","169090","82","4.32",""
"41112","Ф29 - ГР. КЮСТЕНДИЛ УЛ.ЦАР ОСВОБОДИТЕЛ","ШАМПОАН BOTANIC THERAPY МЕД И ПРОПОЛИС 400 МЛ","169091","82","5.36",""
"41112","Ф29 - ГР. КЮСТЕНДИЛ УЛ.ЦАР ОСВОБОДИТЕЛ","ШАМПОАН BOTANIC THERAPY РИЦИН МАСЛО И БАДЕМ 400 МЛ","169095","82","5.36",""
"41112","Ф29 - ГР. КЮСТЕНДИЛ УЛ.ЦАР ОСВОБОДИТЕЛ","КОМПЛЕКТ САПУН DOVE ORIGINAL 4 БР X 90 Г","169153","83","3.98",""
"41112","Ф29 - ГР. КЮСТЕНДИЛ УЛ.ЦАР ОСВОБОДИТЕЛ","ШАМПОАН SCHAUMA STRENGTH & VITALITY 400 МЛ","169242","82","2.91",""
"41112","Ф29 - ГР. КЮСТЕНДИЛ УЛ.ЦАР ОСВОБОДИТЕЛ","ШАМПОАН ELSEVE DREAM LONG 250 МЛ","169287","82","5.57",""
"41112","Ф29 - ГР. КЮСТЕНДИЛ УЛ.ЦАР ОСВОБОДИТЕЛ","ШАМПОАН ELSEVE DREAM LONG 400 МЛ","169288","82","7.39",""
"41112","Ф29 - ГР. КЮСТЕНДИЛ УЛ.ЦАР ОСВОБОДИТЕЛ","ШАМПОАН GLISS SPLIT HAIR MIRACLE 250 МЛ","169469","82","4.58",""
"41112","Ф29 - ГР. КЮСТЕНДИЛ УЛ.ЦАР ОСВОБОДИТЕЛ","ШАМПОАН SYOSS MEN CLEAN & COOL 440 МЛ МЪЖКИ","169471","82","4.34",""
"41112","Ф29 - ГР. КЮСТЕНДИЛ УЛ.ЦАР ОСВОБОДИТЕЛ","ШАМПОАН SYOSS KERATIN 440 МЛ","169474","82","4.34",""
"41112","Ф29 - ГР. КЮСТЕНДИЛ УЛ.ЦАР ОСВОБОДИТЕЛ","ШАМПОАН SYOSS MEN POWER 440 МЛ МЪЖКИ","169475","82","4.34",""
"41112","Ф29 - ГР. КЮСТЕНДИЛ УЛ.ЦАР ОСВОБОДИТЕЛ","ШАМПОАН SYOSS VOLUME 440 МЛ","169480","82","4.34",""
"41112","Ф29 - ГР. КЮСТЕНДИЛ УЛ.ЦАР ОСВОБОДИТЕЛ","САПУН DOVE PINK 90 Г","169519","83","1.19",""
"41112","Ф29 - ГР. КЮСТЕНДИЛ УЛ.ЦАР ОСВОБОДИТЕЛ","САПУН ТЕО MILK DELICATE CARE 90 Г","169561","83","1.02",""
"41112","Ф29 - ГР. КЮСТЕНДИЛ УЛ.ЦАР ОСВОБОДИТЕЛ","САПУН ТЕО MILK HONEY 90 Г","169562","83","1.02",""
"41112","Ф29 - ГР. КЮСТЕНДИЛ УЛ.ЦАР ОСВОБОДИТЕЛ","САПУН ТЕО GENTLE CARE 90 Г","169563","83","1.02",""
"41112","Ф29 - ГР. КЮСТЕНДИЛ УЛ.ЦАР ОСВОБОДИТЕЛ","САПУН ТЕО MILK SENSUAL CARE 90 Г","169565","83","1.02",""
"41112","Ф29 - ГР. КЮСТЕНДИЛ УЛ.ЦАР ОСВОБОДИТЕЛ","САПУН ТЕО MILK  COCONUT 90 Г","169566","83","1.02",""
"41112","Ф29 - ГР. КЮСТЕНДИЛ УЛ.ЦАР ОСВОБОДИТЕЛ","САПУН ЧИСТО ВЪГЛЕН 90 Г","169568","83","1.02","0.75"
"41112","Ф29 - ГР. КЮСТЕНДИЛ УЛ.ЦАР ОСВОБОДИТЕЛ","САПУН KRISPA ШЕА И АРГАН 100 Г","169581","83","1.10",""
"41112","Ф29 - ГР. КЮСТЕНДИЛ УЛ.ЦАР ОСВОБОДИТЕЛ","САПУН SOAPFACTORY СЛЪНЧЕВ 110 Г","169586","83","3.20",""
"41112","Ф29 - ГР. КЮСТЕНДИЛ УЛ.ЦАР ОСВОБОДИТЕЛ","САПУН ТЕО MILK ULTRA HYGIENE 90 Г АНТИБАКТ. СЪСТАВКА","169598","83","1.02",""
"41112","Ф29 - ГР. КЮСТЕНДИЛ УЛ.ЦАР ОСВОБОДИТЕЛ","САПУН TESORI D ORIENTE БЯЛ МУСКУС 125 Г","169606","83","2.74",""
"41112","Ф29 - ГР. КЮСТЕНДИЛ УЛ.ЦАР ОСВОБОДИТЕЛ","САПУН TESORI D ORIENTE КИТАЙСКА ОРХИДЕЯ 125 Г","169607","83","2.74",""
"41112","Ф29 - ГР. КЮСТЕНДИЛ УЛ.ЦАР ОСВОБОДИТЕЛ","САПУН PALMOLIVE HYGIENE PLUS АЛОЕ 90 Г","169637","83","1.22",""
"41112","Ф29 - ГР. КЮСТЕНДИЛ УЛ.ЦАР ОСВОБОДИТЕЛ","САПУН PALMOLIVE HYGIENE PLUS ЕВКАЛИПТ * 90 Г","169638","83","1.22",""
"41112","Ф29 - ГР. КЮСТЕНДИЛ УЛ.ЦАР ОСВОБОДИТЕЛ","К-Т САПУН SAFEGUARD КЛАСИК 4БР Х 90Г","169653","83","4.19",""
"41112","Ф29 - ГР. КЮСТЕНДИЛ УЛ.ЦАР ОСВОБОДИТЕЛ","САПУН KRISPA ГЛИЦЕРИНОВ 100 Г","169698","83","1.82",""
"41112","Ф29 - ГР. КЮСТЕНДИЛ УЛ.ЦАР ОСВОБОДИТЕЛ","САПУН ENGLISH SOAP MEN САНД. ДЪРВО И АМБЪР 190 Г","169699","83","6.64","5.09"
"41112","Ф29 - ГР. КЮСТЕНДИЛ УЛ.ЦАР ОСВОБОДИТЕЛ","ШАМПОАН GLISS SPLIT HAIR MIRACLE 400 МЛ","169757","82","4.75",""
"41112","Ф29 - ГР. КЮСТЕНДИЛ УЛ.ЦАР ОСВОБОДИТЕЛ","ШАМПОАН ELSEVE HYALURON 250 МЛ","169765","82","5.57",""
"41112","Ф29 - ГР. КЮСТЕНДИЛ УЛ.ЦАР ОСВОБОДИТЕЛ","ШАМПОАН ELSEVE HYALURON 400 МЛ","169766","82","7.39",""
"41112","Ф29 - ГР. КЮСТЕНДИЛ УЛ.ЦАР ОСВОБОДИТЕЛ","** ШАМПОАН SCHAUMA ЯБЪЛКА И КОПРИВА 400 МЛ","169846","82","2.91",""
"41112","Ф29 - ГР. КЮСТЕНДИЛ УЛ.ЦАР ОСВОБОДИТЕЛ","ШАМПОАН ALPECIN C1 КОФЕИНОВ 250 МЛ","169860","82","6.64","6.19"
"41112","Ф29 - ГР. КЮСТЕНДИЛ УЛ.ЦАР ОСВОБОДИТЕЛ","ШАМПОАН ALPECIN ХИБРИД КОФЕИНОВ 250 МЛ","169862","82","7.97","6.99"
"41112","Ф29 - ГР. КЮСТЕНДИЛ УЛ.ЦАР ОСВОБОДИТЕЛ","ШАМПОАН AROMA NATURAL ЯЙЦЕ И МЕД УВРЕДЕНА СУХА КОСА 400 МЛ","169879","82","1.94",""
"41112","Ф29 - ГР. КЮСТЕНДИЛ УЛ.ЦАР ОСВОБОДИТЕЛ","ШАМПОАН AROMA NATURAL ХИНИН И КОФЕИН КОСОПАД 400 МЛ","169880","82","1.94",""
"41112","Ф29 - ГР. КЮСТЕНДИЛ УЛ.ЦАР ОСВОБОДИТЕЛ","ШАМПОАН AROMA NATURAL ЧАЕНО ДЪРВО ПЪРХОТ 400 МЛ","169881","82","1.94",""
"41112","Ф29 - ГР. КЮСТЕНДИЛ УЛ.ЦАР ОСВОБОДИТЕЛ","ШАМПОАН HEAD & SHOULDERS КЛАСИК 500 МЛ","169885","82","6.33",""
"41112","Ф29 - ГР. КЮСТЕНДИЛ УЛ.ЦАР ОСВОБОДИТЕЛ","ШАМПОАН HEAD & SHOULDERS ЦИТРУС 500 МЛ","169886","82","6.33",""
"41112","Ф29 - ГР. КЮСТЕНДИЛ УЛ.ЦАР ОСВОБОДИТЕЛ","ШАМПОАН AROMA NATURAL АЛОЕ ВСЕКИ ТИП КОСА 400 МЛ","169890","82","1.94",""
"41112","Ф29 - ГР. КЮСТЕНДИЛ УЛ.ЦАР ОСВОБОДИТЕЛ","ШАМПОАН FRUCTIS ALOE 400 МЛ","169975","82","5.62","4.25"
"41112","Ф29 - ГР. КЮСТЕНДИЛ УЛ.ЦАР ОСВОБОДИТЕЛ","ШАМПОАН FRUCTIS COCONUT WATER 400 МЛ","169976","82","5.62","4.25"
"41112","Ф29 - ГР. КЮСТЕНДИЛ УЛ.ЦАР ОСВОБОДИТЕЛ","ШАМПОАН PANTENE INFINITE 400 МЛ","169997","82","7.15",""
"41112","Ф29 - ГР. КЮСТЕНДИЛ УЛ.ЦАР ОСВОБОДИТЕЛ","ШАМПОАН PANTENE AQUA LIGHT 400 МЛ","169998","82","7.15",""
"41112","Ф29 - ГР. КЮСТЕНДИЛ УЛ.ЦАР ОСВОБОДИТЕЛ","ПРЕПАРАТ ЗА СЪДОВЕ ЕХО БАЛСАМ ЛАЙКА 400 МЛ","170925","79","1.49","1.15"
"41112","Ф29 - ГР. КЮСТЕНДИЛ УЛ.ЦАР ОСВОБОДИТЕЛ","САПУН DOVE DRAGON FRUIT 90 Г","172130","83","1.19",""
"41112","Ф29 - ГР. КЮСТЕНДИЛ УЛ.ЦАР ОСВОБОДИТЕЛ","ШАМПОАН ЗДРАВЕ АКТИВ ПАНТЕНОЛ И ХИНИН 390 МЛ","172210","82","5.11",""
"41112","Ф29 - ГР. КЮСТЕНДИЛ УЛ.ЦАР ОСВОБОДИТЕЛ","ШАМПОАН BOTANIC THERAPY OAT DELICACY 400 МЛ","172213","82","5.36",""
"41112","Ф29 - ГР. КЮСТЕНДИЛ УЛ.ЦАР ОСВОБОДИТЕЛ","ШАМПОАН FRUCTIS GROW STRONG VITAMIN 400 МЛ","172214","82","5.62","4.25"
"41112","Ф29 - ГР. КЮСТЕНДИЛ УЛ.ЦАР ОСВОБОДИТЕЛ","ШАМПОАН ALPECIN C1 BLACK EDITION 250 МЛ","172222","82","7.66","6.69"
"41112","Ф29 - ГР. КЮСТЕНДИЛ УЛ.ЦАР ОСВОБОДИТЕЛ","ШАМПОАН WASH & GO БИЛКИ 360 МЛ","172245","82","3.98",""
"41112","Ф29 - ГР. КЮСТЕНДИЛ УЛ.ЦАР ОСВОБОДИТЕЛ","ШАМПОАН WASH & GO КОПРИВА 360 МЛ","172246","82","3.98",""
"41112","Ф29 - ГР. КЮСТЕНДИЛ УЛ.ЦАР ОСВОБОДИТЕЛ","ШАМПОАН WASH & GO МЕД 360 МЛ","172248","82","3.98",""
"41112","Ф29 - ГР. КЮСТЕНДИЛ УЛ.ЦАР ОСВОБОДИТЕЛ","ШАМПОАН WASH & GO МЕНТОЛ 360 МЛ","172249","82","3.98",""
"41112","Ф29 - ГР. КЮСТЕНДИЛ УЛ.ЦАР ОСВОБОДИТЕЛ","ШАМПОАН WASH & GO ПРОТИВ ПЪРХОТ 360 МЛ","172250","82","3.98",""
"41112","Ф29 - ГР. КЮСТЕНДИЛ УЛ.ЦАР ОСВОБОДИТЕЛ","ШАМПОАН BOTANIC THERAPY MAGNETIC CHARCOAL 250 МЛ","172259","82","4.32",""
"41112","Ф29 - ГР. КЮСТЕНДИЛ УЛ.ЦАР ОСВОБОДИТЕЛ","ШАМПОАН BOTANIC THERAPY MAGNETIC CHARCOAL 400 МЛ","172260","82","5.36",""
"41112","Ф29 - ГР. КЮСТЕНДИЛ УЛ.ЦАР ОСВОБОДИТЕЛ","ШАМПОАН MENS GROOMING ПОРХРАНВАЩ ТРЪН И ПИПЕР 300 МЛ","172263","82","15.33",""
"41112","Ф29 - ГР. КЮСТЕНДИЛ УЛ.ЦАР ОСВОБОДИТЕЛ","ШАМПОАН WASH & GO АЛОЕ 360 МЛ","172264","82","3.98",""
"41112","Ф29 - ГР. КЮСТЕНДИЛ УЛ.ЦАР ОСВОБОДИТЕЛ","ШАМПОАН WASH & GO ЖАСМИН 360 МЛ","172265","82","3.98",""
"41112","Ф29 - ГР. КЮСТЕНДИЛ УЛ.ЦАР ОСВОБОДИТЕЛ","ШАМПОАН WASH & GO ЛАВАНДУЛА 360 МЛ","172266","82","3.98",""
"41112","Ф29 - ГР. КЮСТЕНДИЛ УЛ.ЦАР ОСВОБОДИТЕЛ","ШАМПОАН YVES ROCHER ЗА ВЪЗСТАНОВЯВАНЕ 300 МЛ","172302","82","6.95",""
"41112","Ф29 - ГР. КЮСТЕНДИЛ УЛ.ЦАР ОСВОБОДИТЕЛ","ШАМПОАН YVES ROCHER ЗА КЪДРАВА КОСА 300 МЛ","172304","82","6.95",""
"41112","Ф29 - ГР. КЮСТЕНДИЛ УЛ.ЦАР ОСВОБОДИТЕЛ","ШАМПОАН YVES ROCHER ЗА ОБЕМ 300 МЛ","172306","82","6.95",""
"41112","Ф29 - ГР. КЮСТЕНДИЛ УЛ.ЦАР ОСВОБОДИТЕЛ","ШАМПОАН YVES ROCHER ПРОТИВ КОСОПАД 300 МЛ","172308","82","6.95",""
"41112","Ф29 - ГР. КЮСТЕНДИЛ УЛ.ЦАР ОСВОБОДИТЕЛ","ШАМПОАН YVES ROCHER ПРОТИВ ПЪРХОТ 300 МЛ","172309","82","6.95",""
"41112","Ф29 - ГР. КЮСТЕНДИЛ УЛ.ЦАР ОСВОБОДИТЕЛ","ШАМПОАН HEAD & SHOULDERS КЛАСИК 250 МЛ","172754","82","3.98",""
"41112","Ф29 - ГР. КЮСТЕНДИЛ УЛ.ЦАР ОСВОБОДИТЕЛ","ШАМПОАН HEAD & SHOULDERS ДЪЛБОКА ХИДРАТАЦИЯ 250 МЛ","172755","82","3.98",""
"41112","Ф29 - ГР. КЮСТЕНДИЛ УЛ.ЦАР ОСВОБОДИТЕЛ","ШАМПОАН HEAD & SHOULDERS МЕНТОЛ 250 МЛ","172756","82","3.98",""
"41112","Ф29 - ГР. КЮСТЕНДИЛ УЛ.ЦАР ОСВОБОДИТЕЛ","ШАМПОАН HEAD & SHOULDERS CLASSIC CLEAN 2В1 330 МЛ","172763","82","5.11",""
"41112","Ф29 - ГР. КЮСТЕНДИЛ УЛ.ЦАР ОСВОБОДИТЕЛ","ШАМПОАН HEAD & SHOULDERS MENTHOL FRESH 2В1 330 МЛ","172764","82","5.11",""
"41112","Ф29 - ГР. КЮСТЕНДИЛ УЛ.ЦАР ОСВОБОДИТЕЛ","* ШАМПОАН HEAD & SHOULDERS MENTHOL FRESH 330 МЛ","172765","82","5.11",""
"41112","Ф29 - ГР. КЮСТЕНДИЛ УЛ.ЦАР ОСВОБОДИТЕЛ","ШАМПОАН ЗА КОСА ELSEVE HYALURON PURE 250 МЛ","172767","82","5.57",""
"41112","Ф29 - ГР. КЮСТЕНДИЛ УЛ.ЦАР ОСВОБОДИТЕЛ","ШАМПОАН ЗА КОСА ELSEVE HYALURON PURE 400 МЛ","172768","82","7.39",""
"41112","Ф29 - ГР. КЮСТЕНДИЛ УЛ.ЦАР ОСВОБОДИТЕЛ","ШАМПОАН HEAD & SHOULDERS CITRUS FRESH 330 МЛ","172773","82","5.11",""
"41112","Ф29 - ГР. КЮСТЕНДИЛ УЛ.ЦАР ОСВОБОДИТЕЛ","ШАМПОАН HEAD & SHOULDERS CLASSIC 330 МЛ","172775","82","5.11",""
"41112","Ф29 - ГР. КЮСТЕНДИЛ УЛ.ЦАР ОСВОБОДИТЕЛ","ШАМПОАН HEAD & SHOULDERS OCEAN 330 МЛ","172777","82","5.11",""
"41112","Ф29 - ГР. КЮСТЕНДИЛ УЛ.ЦАР ОСВОБОДИТЕЛ","ШАМПОАН HEAD & SHOULDERS 2В1 ЦЯЛОСТНА ГРИЖА 330 МЛ","172782","82","5.11",""
"41112","Ф29 - ГР. КЮСТЕНДИЛ УЛ.ЦАР ОСВОБОДИТЕЛ","ШАМПОАН HEAD & SHOULDERS ДЪЛБОКА ХИДРАТАЦИЯ 500 МЛ","172784","82","6.33",""
"41112","Ф29 - ГР. КЮСТЕНДИЛ УЛ.ЦАР ОСВОБОДИТЕЛ","ШАМПОАН HEAD & SHOULDERS КОФЕИН ЗА МЪЖЕ 330 МЛ","172786","82","5.11",""
"41112","Ф29 - ГР. КЮСТЕНДИЛ УЛ.ЦАР ОСВОБОДИТЕЛ","ШАМПОАН HEAD & SHOULDERS МЕНТОЛ 500 МЛ","172787","82","6.33",""
"41112","Ф29 - ГР. КЮСТЕНДИЛ УЛ.ЦАР ОСВОБОДИТЕЛ","ШАМПОАН HEAD & SHOULDERS ПРИДАВАЩ ОБЕМ 330 МЛ","172788","82","5.11",""
"41112","Ф29 - ГР. КЮСТЕНДИЛ УЛ.ЦАР ОСВОБОДИТЕЛ","ЧЕТКА ЗА ЗЪБИ TRISA GUM PROTECT MEDIUM 1 БР","172814","80","3.52",""
"41112","Ф29 - ГР. КЮСТЕНДИЛ УЛ.ЦАР ОСВОБОДИТЕЛ","ПАСТА ЗА ЗЪБИ COLGATE MAX WHITE PURPLE REVEAL 75 МЛ","172821","81","2.76",""
"41112","Ф29 - ГР. КЮСТЕНДИЛ УЛ.ЦАР ОСВОБОДИТЕЛ","ПАСТА ЗА ЗЪБИ SENSODYNE SENSITIVE & GUM WHITENING 75 МЛ","172822","81","5.57",""
"41112","Ф29 - ГР. КЮСТЕНДИЛ УЛ.ЦАР ОСВОБОДИТЕЛ","ПАСТА ЗА ЗЪБИ COLGATE ADVANCED BAKING SODA & VOLCANO 75 МЛ","172825","81","3.06",""
"41112","Ф29 - ГР. КЮСТЕНДИЛ УЛ.ЦАР ОСВОБОДИТЕЛ","ПАСТА ЗА ЗЪБИ COLGATE ADVANCED WHITE CHARCOAL 125 МЛ","172826","81","4.09",""
"41112","Ф29 - ГР. КЮСТЕНДИЛ УЛ.ЦАР ОСВОБОДИТЕЛ","ПАСТА ЗА ЗЪБИ AQUAFRESH ALL IN ONE PURE BREATH 75 МЛ","172834","81","3.01","2.49"
"41112","Ф29 - ГР. КЮСТЕНДИЛ УЛ.ЦАР ОСВОБОДИТЕЛ","ПАСТА ЗА ЗЪБИ PARODONTAX ACTIVE REPAIR FRESH MINT 75 МЛ","172836","81","4.80",""
"41112","Ф29 - ГР. КЮСТЕНДИЛ УЛ.ЦАР ОСВОБОДИТЕЛ","ПАСТА ЗА ЗЪБИ PARODONTAX ACTIVE REPAIR WHITE 75 МЛ","172837","81","4.80",""
"41112","Ф29 - ГР. КЮСТЕНДИЛ УЛ.ЦАР ОСВОБОДИТЕЛ","ПАСТА ЗА ЗЪБИ COLGATE MAX WHITE EXP ULTRA MULTIPURPOSE 50 МЛ","172851","81","5.60",""
"41112","Ф29 - ГР. КЮСТЕНДИЛ УЛ.ЦАР ОСВОБОДИТЕЛ","ПАСТА ЗА ЗЪБИ COLGATE MAX FRESH GREEN TEA 75 МЛ","172870","81","3.06",""
"41112","Ф29 - ГР. КЮСТЕНДИЛ УЛ.ЦАР ОСВОБОДИТЕЛ","ПАСТА ЗА ЗЪБИ LACALUT ACTIV PLUS 75 МЛ","172874","81","5.87","3.79"
"41112","Ф29 - ГР. КЮСТЕНДИЛ УЛ.ЦАР ОСВОБОДИТЕЛ","ПАСТА ЗА ЗЪБИ ORAL-B 3DW LUXE 75 МЛ","172875","81","3.88",""
"41112","Ф29 - ГР. КЮСТЕНДИЛ УЛ.ЦАР ОСВОБОДИТЕЛ","ПАСТА ЗА ЗЪБИ ORAL-B 3DW PRO ARCTIC FRESH 75 МЛ","172876","81","3.56",""
"41112","Ф29 - ГР. КЮСТЕНДИЛ УЛ.ЦАР ОСВОБОДИТЕЛ","ПАСТА ЗА ЗЪБИ ORAL-B 3DW PRO VITALIZING FRESH 75 МЛ","172877","81","3.56",""
"41112","Ф29 - ГР. КЮСТЕНДИЛ УЛ.ЦАР ОСВОБОДИТЕЛ","ПАСТА ЗА ЗЪБИ ORAL-B COMPLETE PROTECT & CLEAN 75 МЛ","172878","81","2.75",""
"41112","Ф29 - ГР. КЮСТЕНДИЛ УЛ.ЦАР ОСВОБОДИТЕЛ","ПАСТА ЗА ЗЪБИ ORAL-B COMPLETE ULTIMATE FRESH 75 МЛ","172879","81","2.75",""
"41112","Ф29 - ГР. КЮСТЕНДИЛ УЛ.ЦАР ОСВОБОДИТЕЛ","ПАСТА ЗА ЗЪБИ ORAL-B PRO EXPERT CLEAN MINT 75 МЛ","172880","81","3.56",""
"41112","Ф29 - ГР. КЮСТЕНДИЛ УЛ.ЦАР ОСВОБОДИТЕЛ","ПАСТА ЗА ЗЪБИ ORAL-B PRO EXPERT SENSITIVE 75 МЛ","172881","81","3.56",""
"41112","Ф29 - ГР. КЮСТЕНДИЛ УЛ.ЦАР ОСВОБОДИТЕЛ","ПАСТА ЗА ЗЪБИ SENSODYNE CLINICAL REPAIR 75 МЛ","172892","81","5.57",""
"41112","Ф29 - ГР. КЮСТЕНДИЛ УЛ.ЦАР ОСВОБОДИТЕЛ","ПАСТА ЗА ЗЪБИ ORAL-B PRO REPAIR ORIGINAL 75 МЛ","172896","81","6.06",""
"41112","Ф29 - ГР. КЮСТЕНДИЛ УЛ.ЦАР ОСВОБОДИТЕЛ","ШАМПОАН PANTENE REPAIR PROTECT 400 МЛ","172920","82","7.15",""
"41112","Ф29 - ГР. КЮСТЕНДИЛ УЛ.ЦАР ОСВОБОДИТЕЛ","КЪРПИ ВЛАЖНИ HANKIES EXTRA SAFE АНТИБАКТ. 4Х12 БР","173921","84","1.89","1.55"
"41112","Ф29 - ГР. КЮСТЕНДИЛ УЛ.ЦАР ОСВОБОДИТЕЛ","ПАСТА ЗА ЗЪБИ ELMEX SENSITIVE 75 МЛ","176007","81","4.29",""
"41112","Ф29 - ГР. КЮСТЕНДИЛ УЛ.ЦАР ОСВОБОДИТЕЛ","ПАСТА ЗА ЗЪБИ ELMEX SENSITIVE PLUS COMPLETE PTOTECTION 75 МЛ","176009","81","5.36",""
"41112","Ф29 - ГР. КЮСТЕНДИЛ УЛ.ЦАР ОСВОБОДИТЕЛ","ПАСТА ЗА ЗЪБИ ELMEX SENSITIVE PROFESSIONAL ZINK 75 МЛ","176010","81","5.36",""
"41112","Ф29 - ГР. КЮСТЕНДИЛ УЛ.ЦАР ОСВОБОДИТЕЛ","ПАСТА ЗА ЗЪБИ ELMEX SENSITIVE GENTLE WHITE 75 МЛ","176011","81","4.29",""
"41112","Ф29 - ГР. КЮСТЕНДИЛ УЛ.ЦАР ОСВОБОДИТЕЛ","ПАСТА ЗА ЗЪБИ PARODONTAX STRENGTHEN & PROTECT FM 75 МЛ","176016","81","4.80",""
"41112","Ф29 - ГР. КЮСТЕНДИЛ УЛ.ЦАР ОСВОБОДИТЕЛ","ПАСТА ЗА ЗЪБИ PARODONTAX STRENGTHEN & PROTECT WHITE 75 МЛ","176017","81","4.80",""
"41112","Ф29 - ГР. КЮСТЕНДИЛ УЛ.ЦАР ОСВОБОДИТЕЛ","ПАСТА ЗА ЗЪБИ SENSODYNE CLINICAL REPAIR WHITE 75 МЛ","176019","81","5.57",""
"41112","Ф29 - ГР. КЮСТЕНДИЛ УЛ.ЦАР ОСВОБОДИТЕЛ","ПАСТА ЗА ЗЪБИ SENSODYNE COMPLETE PROTECTION WHITE 75 МЛ","176020","81","5.57",""
"41112","Ф29 - ГР. КЮСТЕНДИЛ УЛ.ЦАР ОСВОБОДИТЕЛ","ПАСТА ЗА ЗЪБИ COLGATE ADVANCED WHITE 125 МЛ","176021","81","4.09",""
"41112","Ф29 - ГР. КЮСТЕНДИЛ УЛ.ЦАР ОСВОБОДИТЕЛ","ПАСТА ЗА ЗЪБИ COLGATE MAX EXPERT PURIFYING POWER 75 МЛ","176023","81","5.60",""
"41112","Ф29 - ГР. КЮСТЕНДИЛ УЛ.ЦАР ОСВОБОДИТЕЛ","ПАСТА ЗА ЗЪБИ COLGATE MAX WHITE SPARKLING DIAMONDS 75 МЛ","176024","81","3.06",""
"41112","Ф29 - ГР. КЮСТЕНДИЛ УЛ.ЦАР ОСВОБОДИТЕЛ","ПАСТА ЗА ЗЪБИ COLGATE MAX WHITE SUPERIOR CLEAN 75 МЛ","176025","81","2.76",""
"41112","Ф29 - ГР. КЮСТЕНДИЛ УЛ.ЦАР ОСВОБОДИТЕЛ","ЧЕТКА ЗА ЗЪБИ ORAL-B PRO 3D WHITE MEDIUM 2 БР","176034","80","3.83",""
